"show_id","director","cast","country","release_year","rating","duration","listed_in","date_added_month","date_added_day","date_added_year"
"s1990",,"Benedetta Porcaroli, Alice Pagani, Riccardo Mandolini, Chabeli Sastre Gonzalez, Brando Pacitto, Lorenzo Zurzolo, Claudia Pandolfi, Galatea Ranzi","Italy",2020,"TV-MA","3 Seasons","International TV Shows, TV Dramas, Teen TV Shows","September","16",2020
"s1991",,,"United States",2020,"TV-14","1 Season","Docuseries, Science & Nature TV","September","16",2020
"s1992",,"Katherine Kelly, Lee Ingleby, Mark Stanley, Rochenda Sandall, Shubham Saraf, Nicholas Pinnock, David Tennant, Hayley Atwell, Youssef Kerkour, Clare-Hope Ashitey, Isabella Laughland","United Kingdom, France, Germany, Spain",2020,"TV-MA","2 Seasons","British TV Shows, Crime TV Shows, International TV Shows","September","16",2020
"s1994",,"Andrzej Konopka, Helena Sujecka, Piotr Trojan, Micha≈Ç Czernecki, Mariusz Ostrowski, Robert Gulaczyk, Miros≈Çaw Kropielnicki, Helena Englert, Paulina Ga≈ÇƒÖzka, Magdalena ≈πak","Poland",2020,"TV-MA","2 Seasons","Crime TV Shows, International TV Shows, TV Dramas","September","16",2020
"s1995",,"Tituss Burgess","United States",2020,"TV-PG","1 Season","Reality TV","September","16",2020
"s1999","PHILIPPA LOWTHORPE","Vanessa Redgrave, Bryony Hannah, Helen George, Jenny Agutter, Pam Ferris, Laura Main, Judy Parfitt, Cliff Parisi, Stephen McGann, Ben Caplan, Miranda Hart, Jessica Raine, Max Macmillan, Victoria Yeates, Jack Ashton, Emerald Fennell, Linda Bassett","United Kingdom",2020,"TV-MA","9 Seasons","British TV Shows, International TV Shows, TV Dramas","September","15",2020
"s2003",,,"United States",2020,"TV-MA","2 Seasons","Docuseries, International TV Shows, Reality TV","September","15",2020
"s2007",,"Greta Jameson, Ralf Jameson, Clementine Laikin, Felix Laikin","United Kingdom, China",2020,"TV-Y","2 Seasons","British TV Shows, Kids' TV","September","11",2020
"s2009",,"Jonathan Cohen, G√©rard Darmon, Julia Piaton, Liliane Rov√®re, Olivier Rosemberg, Ali Marhyar, Lina El Arabi, Louise Coldefy, Enrico Macias, Val√©rie Damidot","France",2020,"TV-MA","2 Seasons","International TV Shows, TV Comedies, TV Dramas","September","11",2020
"s2010",,"Tracee Ellis Ross, Golden Brooks, Persia White, Jill Marie Jones, Reginald C. Hayes","United States",2007,"TV-14","8 Seasons","TV Comedies","September","11",2020
"s2013",,"Unax Ugalde, Olivia Molina, Eleonora Wexler, Abel Folk, √?ngela Molina, Manu Fullola, Daniel Ib√°√±ez, Laura Quir√≥s, Nicol√°s Illoro, Bel√©n √âcija, Juan Blanco, Yaima Ramos","Spain",2020,"TV-MA","1 Season","International TV Shows, Spanish-Language TV Shows, TV Dramas","September","11",2020
"s2014",,"Katherine Ryan, Rory Keenan, Katy Byrne, Doon Mackichan, Steen Raskopoulos, Michelle de Swarte, Sophie Fletcher","United Kingdom",2020,"TV-MA","1 Season","British TV Shows, International TV Shows, TV Comedies","September","11",2020
"s2022",,"Merle Dandridge, Kim Hawthorne, Desiree Ross, Lamman Rucker, Tye White, Lynn Whitfield, Deborah Joy Winans, Keith David, Lovie Simone, Gregory Alan Williams, Oprah Winfrey","United States",2020,"TV-14","5 Seasons","TV Dramas","September","10",2020
"s2023","KENNY ORTEGA","Madison Reyes, Charlie Gillespie, Owen Patrick Joyner, Jeremy Shada, Jadah Marie, Sacha Carlson, Savannah Lee May, Cheyenne Jackson, Carlos Ponce, Booboo Stewart, Sonny Bustamante","United States",2020,"TV-G","1 Season","Kids' TV, TV Comedies","September","10",2020
"s2033",,,"United States",2020,"TV-PG","1 Season","Reality TV","September","9",2020
"s2034","PEPE MORA",,"Spain",2020,"TV-MA","1 Season","Crime TV Shows, Docuseries, International TV Shows","September","9",2020
"s2038",,"Park Bo-gum, Park So-dam, Byeon Woo-seok, Ha Hee-ra, Shin Ae-ra, Han Jin-hee, Shin Dong-mi, Lee Chang-hoon, Kwon Soo-hyun, Cho Yu-jung, Park Su-young, Seo Sang-won, Lee Jae-won","South Korea",2020,"TV-14","1 Season","International TV Shows, Romantic TV Shows, TV Dramas","September","8",2020
"s2041",,"Sophia Isabella, Jeremy Levy, Jacob Tillman, Ryan Andes, Deanna McGovern, Dick Terhune",,2020,"TV-Y7","2 Seasons","Kids' TV","September","7",2020
"s2043",,"Hunter Page-Lochard, Rob Collins, Deborah Mailman, Ryan Corr, Stef Dawson, Iain Glen, Frances O'Connor, Tasma Walton, Tony Briggs","Australia, New Zealand, United States",2017,"TV-MA","1 Season","TV Dramas, TV Sci-Fi & Fantasy, TV Thrillers","September","5",2020
"s2045",,"Hilary Swank, Josh Charles, Vivian Wu, Mark Ivanir, Ato Essandoh, Ray Panthaki, Talitha Eliana Bateman","United States",2020,"TV-14","1 Season","Romantic TV Shows, TV Dramas, TV Sci-Fi & Fantasy","September","4",2020
"s2048",,"Amber Frank, Bailey Gambertoglio, Sydney Park, Darcy Rose Byrnes, Rhys Darby","United States",2020,"TV-Y7","2 Seasons","Kids' TV","September","4",2020
"s2054",,"Adam P√•lsson, Richard Dillane, Leanne Best, Ellise Chappell","United Kingdom",2020,"TV-MA","1 Season","Crime TV Shows, International TV Shows, TV Dramas","September","3",2020
"s2055",,,"United States",2020,"TV-14","1 Season","Docuseries, Reality TV","September","2",2020
"s2059",,"Henry Cavill, Anya Chalotra, Freya Allan, Lauren Schmidt Hissrich, Eamon Farren, Mimi Ndiweni, MyAnna Buring, Joey Batey, Adam Levy, Jodhi May",,2020,"TV-MA","1 Season","Docuseries, TV Sci-Fi & Fantasy","September","2",2020
"s2063",,"Nobuhiko Okamoto, Jun Fukuyama, Kana Hanazawa, Kazuya Nakai, Koji Yusa, Yuki Kaji, Eri Kitamura, Ayahi Takagaki, Rina Satou, Daisuke Ono, Ryotaro Okiayu, Tetsuya Kakihara, Hiroshi Kamiya, Keiji Fujiwara, Hiroaki Hirata, Jin Urayama, Katsuyuki Konishi, Kisho Taniyama, M„ÉªA„ÉªO, Kazuhiro Yamaji, Hideyuki Tanaka, Masaki Terasoma, Naomi Shindo","Japan",2017,"TV-MA","2 Seasons","Anime Series, International TV Shows","September","1",2020
"s2064",,"Marley Dias","United States",2020,"TV-Y","1 Season","Kids' TV","September","1",2020
"s2065",,"Sidse Babett Knudsen, Birgitte Hjort S√∏rensen, Pilou Asb√¶k, Emil Poulsen, Freja Riemann, S√∏ren Malling, Thomas Levin, Benedikte Hansen, Mikael Birkkj√¶r, Anders Juul, Lisbeth Wulff, Kasper Lange, Lars Knutzon, S√∏ren Spanning, Christoph Bastrup, Morten Kirkskov, Bjarne Henriksen, Peter Mygind, Ole Thestrup, Iben Dorner, Dar Salim, Jens Albinus, Christian Tafdrup, Alastair Mackenzie, Julie Agnete Vang, Kristian Halken, Ricard Lawrence, Marie Askehave, Rikke Lylloff, Mille Dinesen, Anne Sofie Espersen","Denmark",2012,"TV-MA","3 Seasons","International TV Shows, TV Dramas","September","1",2020
"s2067",,"Tao Tsuchiya, Shinnosuke Mitsushima, Aoi Yuki, Chinatsu Akasaki, Yo Taichi, Akari Kito, Ayaka Nanase, Yukitoshi Kikuchi, Takahiro Mizushima, Minami Takayama, Mitsuru Miyamoto","Japan",2016,"TV-14","1 Season","Anime Series, International TV Shows, TV Thrillers","September","1",2020
"s2069",,"Felipe Esparza","United States",2020,"TV-MA","1 Season","Stand-Up Comedy & Talk Shows, TV Comedies","September","1",2020
"s2070",,"Jamel Debbouze, √âric Judor, Ramzy Bedia, Catherine Benguigui, Sophie Mounicot, Jean-Luc Bideau","France",2002,"TV-MA","4 Seasons","International TV Shows, TV Comedies","September","1",2020
"s2071",,"Monique Hore, Sophia Morrison, Peter McAllum, Nicole Shostak, Jamie Croft, Beth Armstrong, Kate Fitzpatrick, Penny Cook, Charlotte Hamlyn, Tess Meyer","France, Australia, Germany",2020,"TV-Y7","1 Season","Kids' TV","September","1",2020
"s2074",,"Tia Mowry-Hardrict, Jack√©e Harry, Tamera Mowry-Housley, Tim Reid, Marques Houston, RonReaco Lee, Deon Richmond","United States",1998,"TV-PG","6 Seasons","TV Comedies, Teen TV Shows","September","1",2020
"s2079",,"Sumire Morohoshi, Maaya Uchida, Mariya Ise, Yuhko Kaida, Nao Fujita, Shinei Ueki, Lynn, Hiyori Kono, Shizuka Ishigami, Ai Kayano, Mari Hino, Yuko Mori, Ari Ozawa","Japan",2019,"TV-14","1 Season","Anime Series, International TV Shows, TV Thrillers","September","1",2020
"s2081","GREG TIERNAN","Michael Angelis, Ben Small, Keith Wickham, Kerry Shale","United Kingdom",2020,"TV-Y","2 Seasons","British TV Shows, Classic & Cult TV, Kids' TV","September","1",2020
"s2086",,,"United Kingdom, United States",2020,"TV-MA","1 Season","British TV Shows, Crime TV Shows, Docuseries","August","28",2020
"s2087",,"Masaba Gupta, Neena Gupta, Neil Bhoopalam, Rytasha Rathore, Smaran Sahu, Nayan Shukla, Pooja Bedi, Satyadeep Misra","India",2020,"TV-MA","1 Season","International TV Shows, TV Comedies, TV Dramas","August","28",2020
"s2090",,"Kaolip, Komegumi Koiwasaki, Maki Tsuruta, Sohta Arai, Rina Inoue, Shingo Kato, Yuki Takahashi","Japan",2020,"TV-14","3 Seasons","Anime Series, International TV Shows","August","27",2020
"s2094",,"Carolina G√≥mez, Marlon Moreno, George Slebi, Geraldine Zivic, Andrea G√≥mez, Mar√≠a Cecilia Botero, Juliana Galvis, Edwin Maya, Alejandro Guti√©rrez, Viviana Santos, Michelle Manterola, Juan Alfonso Baptista, Carolina Cuervo, Santiago Felipe Gomez, Matias Maldonado, Kristina Lilley, Mauricio Figueroa, Ana Wills, Juan Manuel Diaz, Ricardo Mejia, Orlando Valenzuela, Ana-Mar√≠a S√°nchez, Julieta Villar","Colombia",2020,"TV-MA","1 Season","International TV Shows, Spanish-Language TV Shows, TV Dramas","August","26",2020
"s2097",,,"United States",2020,"TV-MA","1 Season","Reality TV","August","26",2020
"s2099",,"Emily Callandrelli, Sky Alexis, Kennedi Butler, Arya Darbahani, Christopher Farrar, Alex Jayne Go, Jayden Langarcia, Makenzie Lee-Foster, Tenz McCall, Zaela Rae, Mason Wells","United States",2020,"TV-Y","1 Season","Kids' TV","August","25",2020
"s2100",,"Brianna Hildebrand, Kiana Madeira, Quintessa Swindell, Brandon Butler, Odiseas Georgiadis, Henry Zaga, Larry Sullivan, Larisa Oleynik","United States",2020,"TV-MA","2 Seasons","TV Dramas, Teen TV Shows","August","25",2020
"s2102",,,,2019,"TV-MA","1 Season","British TV Shows, Reality TV, Romantic TV Shows","August","22",2020
"s2103",,"'Najite Dede, Jude Chukwuka, Taiwo Arimoro, Odenike Odetola, Funmi Eko, Keppy Ekpenyong","Nigeria",2013,"TV-G","1 Season","International TV Shows, TV Comedies","August","22",2020
"s2106",,"Jake Johnson, Ron Funches, Cleo King, Natasha Leggero, A.D. Miles, Rob Riggle, Steve Berg, Eric Edelstein, Ben Hoffman, Mary Holland, Gil Ozeri, Sam Richardson, Nick Swardson","United States",2020,"TV-MA","1 Season","TV Comedies","August","21",2020
"s2107",,"Mike Hall, Michael Daingerfield","Canada",2020,"TV-14","3 Seasons","International TV Shows, Reality TV","August","21",2020
"s2109","HONG WON-KI","SEOLA, Lee Hyun-joo, Song Chae-yun, Han Ga-rim, Shim So-young","South Korea",2020,"TV-MA","1 Season","International TV Shows, TV Horror, TV Mysteries","August","20",2020
"s2113",,,"United States",2020,"TV-14","1 Season","Reality TV","August","19",2020
"s2114",,,"United States",2020,"TV-14","1 Season","Docuseries, Science & Nature TV","August","19",2020
"s2119",,"Ricardo Hurtado, Monica Ray, Luke Youngblood, Scott  Kreamer, Dan Milano, Gunnar Sizemore, Zehra Fazal, Sandeep Parikh","United States",2020,"TV-Y7","2 Seasons","Kids' TV","August","17",2020
"s2123",,"Seung-woo Cho, Doona Bae, Joon-hyuk Lee, Kyeong-yeong Lee, Jae-myung Yoo, Hye-sun Shin","South Korea",2020,"TV-MA","2 Seasons","Crime TV Shows, International TV Shows, Korean TV Shows","August","16",2020
"s2124",,"Weruche Opia, Gbenro Ajibade, Ireti Doyle, Keppy Ekpenyong, Carol King, Shaffy Bello, Tosan Edremoda Ugbeye, Nina Iphechukwude Anyianuka, Pearl Nkiru Waturuocha, Emmanuel Ikubese, Omowunmi Dada, Paul Adams, Charles Ukpong, Monica Friday, Kevin Ushi",,2016,"TV-PG","1 Season","International TV Shows, Romantic TV Shows, TV Dramas","August","15",2020
"s2125",,"Mille Dinesen, Carsten Bj√∏rnlund, Lise Baastrup, Nikolaj Groth, Ellen Hillings√∏, Morten Vang Simonsen, Lykke Sand Michelsen, Carsten Norgaard, Sara Hjort Ditlevsen, Alexandre Willaume","Denmark",2020,"TV-MA","5 Seasons","International TV Shows, TV Comedies, TV Dramas","August","15",2020
"s2126",,"Moayed Althagafi, Khairiah Abulaban, Ali Alsharif, Adel Redwan, Redwan Alremey, Hind Alsaigh, Reem Alhabib, Khaled Bamashmoos, Fahad Ghazoli, Dareen Albayedh, Naif Althufairi, Mohammad Balkhi","Saudi Arabia",2014,"TV-14","2 Seasons","International TV Shows, TV Dramas","August","15",2020
"s2128",,"Jo√£o Miguel, Bianca Comparato, Michel Gomes, Rodolfo Valente, Vaneza Oliveira, Rafael Lozano, Viviane Porto, Mel Fronckowiak, Sergio Mamberti, Zez√© Motta, Celso Frateschi","Brazil",2020,"TV-MA","4 Seasons","International TV Shows, TV Dramas, TV Sci-Fi & Fantasy","August","14",2020
"s2134",,"Anjelica Bette Fellini, Maddie Phillips, Kadeem Hardison, Virginia Williams, Mackenzie Astin, Shirley Rumierk, Myles Evans, Devon Hales, Spencer House, Eric Graise, Charity Cervantes, Wynn Everett, Method Man","United States",2020,"TV-MA","1 Season","Crime TV Shows, TV Comedies, TV Dramas","August","14",2020
"s2135",,"Andr√©s Parra, Christian Tappan, Marcela Benjumea, Juan Sebasti√°n Calero, Waldo Urrego, Rodrigo Jerez, Katherine V√©lez, Paula Casta√±o, Pedro Su√°rez, √âdgar Vittorino, Rams√©s Ramos, Juan Pablo Barrag√°n","Colombia",2020,"TV-MA","1 Season","Crime TV Shows, International TV Shows, Spanish-Language TV Shows","August","14",2020
"s2136",,"Janet Varney, David Faustino, P.J. Byrne, J.K. Simmons, Dee Bradley Baker, Seychelle Gabriel, Logan Wells, Jeff Bennett, Kiernan Shipka","United States",2014,"TV-Y7","4 Seasons","Kids' TV, TV Action & Adventure, TV Sci-Fi & Fantasy","August","14",2020
"s2137",,"Kensho Ono, Takahiro Sakurai, Mikako Komatsu, Etsuko Kozakura, Subaru Kimura, Kaito Ishikawa, Ami Koshimizu, Yoji Ikuta, Hayato Kimura, Kotaro Nishiyama, Takuya Kirimoto, Tomokazu Seki, Suzuko Mimori","Japan",2018,"TV-Y7","1 Season","Anime Series, Kids' TV","August","14",2020
"s2141",,,"United States",2020,"TV-MA","1 Season","Reality TV","August","12",2020
"s2145",,"Loretta Devine, Tia Mowry-Hardrict, Anthony Alabi, Paul Wight, Allison Munn, Gabriel Iglesias, Sherri Shepherd, Paulina Ch√°vez, Jencarlos Canela","United States",2020,"TV-G","1 Season","Kids' TV, TV Comedies","August","10",2020
"s2146",,"You, Reina Triendl, Yoshimi Tokui, Azusa Babazono, Ryota Yamasato, Shono Hayama","Japan",2019,"TV-MA","2 Seasons","International TV Shows, Reality TV","August","10",2020
"s2149",,"Caroline Chikezie, Bimbo Manuel, Lord Frank, Edmond Enaibe, Taiwo Obileye, Jude Chukwuka, Kunle Coker, Paul Christian Chukwudi, Samuel Abiola Robinson, Simi Adejumo, Ani Iyoho","Nigeria",2016,"TV-14","1 Season","International TV Shows, TV Dramas","August","8",2020
"s2152",,"Ivana Baquero, Jon Kortajarena, Alejandra Onieva, Eloy Azor√≠n, Chiqui Fern√°ndez, Tamar Novas, Daniel Lundh, Manuela Vell√©s, Natalia Rodr√≠guez, Laura Prats, Ignacio Montes, Bego√±a Vargas, Luis Bermejo, Pepe Ocio, Ben Temple, F√©lix G√≥mez, Antonio Dur√°n 'Morris', Eduardo Blanco, Jos√© Sacrist√°n","Spain",2020,"TV-MA","3 Seasons","Crime TV Shows, International TV Shows, Spanish-Language TV Shows","August","7",2020
"s2153",,,,2020,"TV-MA","3 Seasons","Reality TV","August","7",2020
"s2154",,"Palina Rojinski","Germany",2020,"TV-PG","1 Season","International TV Shows, Reality TV","August","7",2020
"s2157",,"Mike Colter","United States",2020,"TV-PG","1 Season","Docuseries, Science & Nature TV, TV Action & Adventure","August","7",2020
"s2158",,"Colin O'Donoghue, David Bradley, Lena Headey, Emile Hirsch, Lexi Medrano, Steven Yeun, Alfred Molina, James Faulkner, Stephanie Beatriz, John Rhys-Davies","United States",2020,"TV-Y7","1 Season","Kids' TV, TV Action & Adventure, TV Sci-Fi & Fantasy","August","7",2020
"s2159",,,"United States",2020,"TV-Y","1 Season","Kids' TV","August","7",2020
"s2161",,"Jonquil Goode, Karen Strassman, Audu Paden, Julie Maddalena, Marieve Herington, Rena Strober, Evan Smith, Wendee Lee, Haviland Stillwell, Valerie Arem, Cam Clarke, Colleen Foy, Cindy Robinson, Joe Sanfelippo, Jamieson Price, Debi Derryberry, Lindsey Ames, Rajo Zakic, Erin Fitzgerald, Malcolm Danare","Canada",2016,"TV-Y7","5 Seasons","Kids' TV","August","6",2020
"s2163",,"Alba August, Lucas Lynggaard T√∏nnesen, Mikkel Boe F√∏lsgaard, Lukas L√∏kken, Jessica Dinnage, Sonny Lindberg, Angela Bundalovic, Lars Simonsen","Denmark, United States",2020,"TV-MA","3 Seasons","International TV Shows, TV Dramas, TV Mysteries","August","6",2020
"s2166",,,"United States",2020,"TV-14","1 Season","Crime TV Shows, Docuseries, International TV Shows","August","5",2020
"s2169",,"Felipe Castanhari, Lilian Regina, Bruno Miranda, Guilherme Briggs","Brazil",2020,"TV-PG","1 Season","Docuseries, International TV Shows, Science & Nature TV","August","4",2020
"s2171",,,"United States",2020,"TV-MA","1 Season","Docuseries","August","3",2020
"s2174",,"Brandy Norwood, William Allen Young, Sheryl Lee Ralph, Countess Vaughn, Lamont Bentley, Shar Jackson, Marcus T. Paulk, Yvette Wilson","United States",2000,"TV-PG","6 Seasons","TV Comedies, Teen TV Shows","August","1",2020
"s2175",,"Morgan Wigle, Tom Hulshof, Helena Marie, Shawn Thompson, Natasha Zaborski, Ajanae Stephenson, Francesca Van Keekan, Jordan Clark","Canada",2020,"TV-G","1 Season","Kids' TV","August","1",2020
"s2176",,"Natsuki Hanae, Kana Hanazawa, Ai Kayano, Ryota Osaka, Kaito Ishikawa, Mikako Komatsu, Kaori Ishihara, Kaori Nazuka, Masuo Amada, Junji Majima, Motomu Kiyokawa, Kohsuke Toriumi","Japan",2014,"TV-14","1 Season","Anime Series, Romantic TV Shows, Teen TV Shows","August","1",2020
"s2179",,"Shamier Anderson, Victoria Baldesarra, Alexandra Beaton, Jordan Clark, Brennan Clost, Samantha Grecchi, Lamar Johnson, Isaac Lupien, Trevor Tordjman, Brittany Raymond, Bree Wasylenko, Jennifer Pappas, Tamina Pollack-Paris, Logan Fabbro, Megan Mackenzie, Alex Beaton, Natalie Krill","Canada",2018,"TV-G","1 Season","Kids' TV, Reality TV, TV Dramas","August","1",2020
"s2181",,"Rie Kugimiya, Junji Majima, Yui Horie, Hirofumi Nojima, Eri Kitamura, Sayaka Ohara, Ai Nonaka, Momoko Ishikawa, Hiroyuki Yoshino, Kazuyuki Okitsu, Rie Tanaka, Yuhko Kaida, Saori Goto","Japan",2008,"TV-14","1 Season","Anime Series, International TV Shows, Romantic TV Shows","August","1",2020
"s2182",,"Adam Andrianopolous, Pierce Cravens, Xander Crowell, Paul Guyet, Michael Hansen, Mason Hensley, Courtney Shaw, Alan Trinca, Keyon Williams, Andy Zou","United States",2020,"TV-Y","2 Seasons","Kids' TV","August","1",2020
"s2185",,"Kim Adis, Mia McKenna-Bruce, Bethany Antonia, Jessica Alexander","United Kingdom",2020,"TV-PG","1 Season","British TV Shows, Crime TV Shows, International TV Shows","July","31",2020
"s2190",,"Candace Nelson, Adriano Zumbo, Hunter March","United States",2020,"TV-PG","3 Seasons","Reality TV","July","31",2020
"s2191",,,"United States, Canada",2020,"TV-14","2 Seasons","TV Action & Adventure, TV Mysteries, TV Sci-Fi & Fantasy","July","31",2020
"s2193",,"Jake Foushee, Jason Marnocha, Linsay Rousseau, Joe Zieja, Frank Todaro, Bill Rogers, Keith Silverstein, Edward Bosco","United States",2020,"TV-Y7","1 Season","Anime Series","July","30",2020
"s2195","NOPPAROJ CHOTMUNKONGSIT","Anusorn Maneethet, Atsadaporn Siriwattanakul, Waratthaya Wongchayaporn, Thanawetch Siriwattanakul, Pokchat Thiamchai, Phichikorn Ployphimana, Supachai Suwanon, Daraneenuch Pasutanavin, Kittiphong Dumavibhat, Aphiradi Phawaphutanon, Attharut Krongrasri, Ronnawee Sereerat, Lita Janvarapa, Sitang Punnapob, Yani Tramod",,2020,"TV-MA","1 Season","International TV Shows, Romantic TV Shows, TV Comedies","July","30",2020
"s2202",,"John Franklin III, DJ Law, Buddy Stephens, Brittany Wagner, Ronald Ollie","United States",2020,"TV-MA","5 Seasons","Docuseries","July","28",2020
"s2204",,"William H. Macy, Emmy Rossum, Justin Chatwin, Cameron Monaghan, Jeremy Allen White, Shanola Hampton, Steve Howey, Ethan Cutkosky, Emma Kenney, Laura Wiggins, Joan Cusack","United States",2019,"TV-MA","10 Seasons","TV Comedies, TV Dramas","July","26",2020
"s2213",,"Ricky Merino","Spain",2020,"TV-G","1 Season","International TV Shows, Reality TV, Spanish-Language TV Shows","July","24",2020
"s2215","ALEX GIBNEY",,"United States",2015,"TV-14","1 Season","Docuseries","July","23",2020
"s2218",,,"United States",2020,"TV-MA","1 Season","Crime TV Shows, Docuseries","July","22",2020
"s2219",,"K√•re Conradi, Silje Torp, Nils J√∏rgen Kaalstad, Marian Saastad Ottesen, Trond Fausa, Kristine Riis, Jon √òigarden, Henrik Mestad, √òystein Martinsen, Mikkel Bratt Silset, Mads J√∏rgensen, Nikis Theophilakis","Norway",2020,"TV-MA","3 Seasons","International TV Shows, TV Comedies","July","22",2020
"s2223",,,,2020,"TV-PG","1 Season","Docuseries, Spanish-Language TV Shows","July","21",2020
"s2224",,"Piers Morgan","United Kingdom",2017,"TV-MA","1 Season","British TV Shows, Crime TV Shows, Docuseries","July","19",2020
"s2226",,,"France",2019,"TV-Y","1 Season","Kids' TV","July","18",2020
"s2227",,"Fifi Box, Matthew Hussey","Australia",2018,"TV-MA","1 Season","Reality TV, Romantic TV Shows","July","18",2020
"s2228",,"Katherine Langford, Devon Terrell, Gustaf Skarsg√•rd, Daniel Sharman, Sebastian Armesto, Lily Newmark, Shalom Brune-Franklin, Matt Stokoe, Bella Dayne, Peter Mullan, Emily Coates","United Kingdom, Australia",2020,"TV-MA","1 Season","TV Action & Adventure, TV Dramas, TV Sci-Fi & Fantasy","July","17",2020
"s2230",,"Perry Mattfeld, Brooke Markham, Casey Deidrick, Keston John, Morgan Krantz, Rich Sommer, Thamela Mpumlwana, Saycon Sengbloh, Kathleen York, Derek Webster","United States",2020,"TV-14","2 Seasons","Crime TV Shows, TV Dramas","July","17",2020
"s2231",,"Caio Horowicz, Iza Moreira, Michel Joelsas, Denise Fraga, Thom√°s Aquino, Luana Nastas, Esther Tinman, Kevin Vechiatto, Grace Pass√¥, Bianca Byington, Bruno Garcia, Fl√°vio Tolezani, Carolina del Carmen Peleritti","Brazil",2020,"TV-MA","1 Season","International TV Shows, TV Dramas, TV Mysteries","July","17",2020
"s2236",,"Maite Perroni, Erik Hayser, Alejandro Speitzer, Mar√≠a Fernanda Yepes, Jorge Poza, Regina Pav√≥n, Paulina Matos, Leticia Huijara, Claudia Pineda, Esteban Soberanes, Claudia R√≠os, Samantha Orozco, Fabi√°n Merlo, Eligio Mel√©ndez, Carmen Beato, Carlos Torres, To√±o Vald√©s","Mexico",2020,"TV-MA","1 Season","Crime TV Shows, International TV Shows, Spanish-Language TV Shows","July","15",2020
"s2238",,,"United States",2020,"TV-MA","1 Season","Reality TV, Science & Nature TV","July","15",2020
"s2239",,"Svetlana Tsimokhina, Dmitri Davidovich","Belarus",2016,"TV-Y","2 Seasons","British TV Shows, Kids' TV, TV Comedies","July","15",2020
"s2242",,"Amaryllis Fox","United States",2020,"TV-MA","1 Season","Docuseries","July","14",2020
"s2246","CASSIA DIAN",,"Brazil",2020,"TV-14","1 Season","International TV Shows, Reality TV, Romantic TV Shows","July","10",2020
"s2247",,"Zac Efron, Darin Olien","United States",2020,"TV-PG","1 Season","Docuseries, Reality TV, Science & Nature TV","July","10",2020
"s2250",,"Nat Faxon, Jay Gragnani, Ramone Hamilton, Sean Astin, Dayci Brookshire, Jorge Diaz, Peter Hastings, Evan Kishiyama, David Koechner, Erica Luttrell, Brennan Murray, Nolan North, Gary Anthony Williams, Secunda Wood","United States",2020,"TV-Y7","1 Season","Kids' TV, TV Action & Adventure, TV Comedies","July","10",2020
"s2252","WOUTER BOUVIJN","Maaike Neuville, Charlotte De Bruyne, Tom Vermeir, Mieke De Groote, Johan Heldenbergh, Zouzou Ben Chikha, Peter Gorissen, Piet De Praitere, Maaike Cafmeyer, Josse De Pauw, Greet Verstraete, Koen De Sutter, Isabelle Van Hecke, Lynn Van Royen","Belgium",2019,"TV-MA","1 Season","Crime TV Shows, International TV Shows, TV Dramas","July","10",2020
"s2254",,"Reina Ueda, Tomo Muranaka, Yuko Sasaki, Masaki Terasoma, Hiroyuki Yoshino, Kensho Ono","Japan",2020,"TV-MA","1 Season","Anime Series, International TV Shows","July","9",2020
"s2255",,"√áaƒüatay Ulusoy, Ay√ßa Ay≈üin Turan, Hazar Erg√º√ßl√º, Okan Yalabƒ±k, Mehmet Kurtulu≈ü, Yurdaer Okur","Turkey",2020,"TV-MA","4 Seasons","International TV Shows, Romantic TV Shows, TV Action & Adventure","July","9",2020
"s2256",,"Song Ji-hyo, Son Ho-jun, Song Jong-ho, Koo Ja-sung, Kim Min-jun, Kim Da-som, Kim Mee-kyung, Um Chae-young, Kim Young-ah, Kim Byung-choon","South Korea",2020,"TV-14","1 Season","International TV Shows, Korean TV Shows, Romantic TV Shows","July","9",2020
"s2259",,"Yvonne Strahovski, Jai Courtney, Cate Blanchett, Asher Keddie, Fayssal Bazzi, Dominic West","Australia",2020,"TV-MA","1 Season","International TV Shows, TV Dramas","July","8",2020
"s2276","RACHIT KUSONKOONSIRI","Peemapol Panichtamrong, Phiravich Attachitsataporn, Thime Pichitsurakit, Jidapa Siribunchawan, Yanin Opassathaworn, Jaturong Kolimart, Pete Thongchua, Ratchanont Sukpragawp, Kanyaphak Pongsak, Kittikun Tansuhas, Tanawat Cheawaram, Toru Takizawa, Noraworn Puangumpai","Thailand",2020,"TV-MA","1 Season","International TV Shows, Romantic TV Shows, TV Comedies","July","5",2020
"s2293",,"Swapnil Kumari, Jigna Bhardwaj, Sonal Kaushal, Neshma Chemburkar, Ganesh Divekar, Shaily Dube, Saumya Daan, Anamaya Verma, Parminder Ghumman, Pawan Kalra","India",2020,"TV-Y7","2 Seasons","Kids' TV, TV Comedies","July","4",2020
"s2294",,"Blanca Su√°rez, Nadia de Santiago, Ana Fern√°ndez, Maggie Civantos, Ana Polvorosa, Yon Gonz√°lez, Marti√±o Rivas, Nico Romero, Borja Luna, Sergio Mur, Concha Velasco, Antonio Vel√°zquez, Ernesto Alterio, Ira del R√≠o, Angela Cremonte, Andrea Carballo","Spain",2019,"TV-MA","6 Seasons","International TV Shows, Romantic TV Shows, Spanish-Language TV Shows","July","3",2020
"s2298",,"Yoshiyoshi Arakawa, Yuina Kuroshima, Ririka, Koki Osamura, Seiko Iwaido, Kai Inowaki, Ryushin Tei, Yuya Matsuura, Kaho Tsuchimura, Takemi Fujii, Ryota Matsushima, Haruka Kubo, Shinsuke Kato, Nana Yanagisawa, Atom Shukugawa, Yura Anno, Tokio Emoto, Nobuko Sendo, Kana Kurashina","Japan",2020,"TV-MA","1 Season","International TV Shows, TV Horror, TV Mysteries","July","3",2020
"s2299",,,"United States",2020,"TV-PG","1 Season","Reality TV","July","3",2020
