"show_id","director","cast","country","release_year","rating","duration","listed_in","date_added_month","date_added_day","date_added_year"
"s3717",,"Soma Saito, Junichi Suwabe, Natsuki Hanae, Yuichi Nakamura, Kenn, Aoi Yuki, Mariya Ise, Katsuyuki Konishi, Toshiyuki Toyonaga, Koji Yusa, Hiroshi Yanaka, Ryoko Shiraishi, Yo Taichi, Marie Miyake, Ryo Hirohashi, Motoko Kumai, Maaya Sakamoto, Hideyuki Tanaka, Bin Shimada","Japan",2019,"TV-14","2 Seasons","Anime Series, International TV Shows","June","24",2019
"s3720","LUIS ALBERTO RESTREPO, ANDR√©S BELTR√°N, JAIME RAYO","Luis Ger√≥nimo Abreu, Jos√© Ram√≥n Barreto, Ernesto Benjumea, F√©lix Antequera, Jefferson Qui√±ones, Shany Nadan, Mar√≠a Jos√© Vargas, Hans Mart√≠nez, Mauro Mauad, √?lvaro Bayona, Rosmeri Marval, Irene Esser, Nohely Arteaga","Colombia",2019,"TV-MA","1 Season","International TV Shows, Romantic TV Shows, Spanish-Language TV Shows","June","21",2019
"s3722",,,"United States",2019,"TV-MA","2 Seasons","Docuseries, Reality TV","June","21",2019
"s3723",,"Pilar Pascual, Renata Toscano, Jos√© Gim√©nez Zapiola, Santiago Saez, Paulo Sanchez Lima, Carmela Barsamian, Axel Mu√±iz, Majo Cardoso, Majo Chicar, Gast√≥n Ricaud, Laura Azcurra","Argentina",2019,"TV-PG","2 Seasons","Kids' TV, Spanish-Language TV Shows, Teen TV Shows","June","21",2019
"s3724",,"Kaori Ishihara, Yuki Kaji, Haruka Tomatsu, Daisuke Ono, Ryohei Kimura, Yoshimasa Hosoya, Takahiro Sakurai, Showtaro Morikubo, Yui Horie, Tomokazu Sugita","Japan",2013,"TV-MA","2 Seasons","Anime Series, International TV Shows","June","21",2019
"s3725",,"Megumi Ogata, Kotono Mitsuishi, Yuriko Yamaguchi, Megumi Hayashibara, Yuko Miyamura, Fumihiko Tachiki, Akira Ishida, Motomu Kiyokawa, Hiro Yuki, Miki Nagasawa, Takehito Koyasu, Tomokazu Seki, Tetsuya Iwanaga, Junko Iwao, Mugihito","Japan",1995,"TV-MA","1 Season","Anime Series, International TV Shows","June","21",2019
"s3726",,"Ryan Phillippe, Omar Epps, David Marciano, Cynthia Addai-Robinson, Shantel VanSanten, Tom Sizemore","United States",2018,"TV-14","3 Seasons","Crime TV Shows, TV Action & Adventure, TV Dramas","June","21",2019
"s3727",,,"New Zealand",2019,"TV-14","2 Seasons","International TV Shows, Reality TV","June","21",2019
"s3728",,,"United States",2019,"TV-MA","2 Seasons","Crime TV Shows, Docuseries","June","21",2019
"s3737",,"Rikiya Koyama, Ayako Kawasumi, Sayaka Ohara, Sho Hayami, Tomokazu Seki, Jouji Nakata, Akina Abe, Takumi Yamasaki, Hikaru Midorikawa, Daisuke Namikawa","Japan",2012,"TV-MA","2 Seasons","Anime Series, International TV Shows","June","15",2019
"s3738",,"Ami Koshimizu, Toshihiko Seki, Ryoka Yuzuki, Aya Suzaki, Shinichiro Miki, Tetsu Inada, Nobuyuki Hiyama, Mayumi Shintani, Hiroyuki Yoshino, Romi Park","Japan",2014,"TV-MA","1 Season","Anime Series, International TV Shows","June","15",2019
"s3742",,"Aoi Yuki, Chiwa Saito, Kaori Mizuhashi, Eri Kitamura, Emiri Kato, Ai Nonaka","Japan",2011,"TV-14","1 Season","Anime Series, International TV Shows","June","15",2019
"s3743",,"Zhang Chao, Li Tingting, Chen Bohao, Sun Jialing, Zhang Zhang, Li Jiuxiao, Deng Yuli, Li Huan, Fang Wenqiang, Gong Rui","China",2019,"TV-MA","1 Season","International TV Shows, Romantic TV Shows, TV Comedies","June","15",2019
"s3744","EL√≠AS LE√≥N",,"Spain",2019,"TV-MA","1 Season","Crime TV Shows, Docuseries, International TV Shows","June","15",2019
"s3745",,"Patrick Ridremont, Constance Gay, Tom Audenaert, Roda Fawaz, Danitza Athanassiadis","Belgium",2017,"TV-MA","1 Season","Crime TV Shows, International TV Shows, TV Dramas","June","15",2019
"s3746",,"James Davis","United States",2019,"TV-PG","1 Season","Reality TV","June","14",2019
"s3747",,"Suliane Brahim, Hubert Delattre, Laurent Capelluto, Samuel Jouy, Renaud Rutten, Camille Aguilar, Tiphaine Daviot, Naidra Ayadi, Brigitte Sy, Anne Suarez, Dan Herzberg, Olivier Bonjour, Thomas Doret","France, Belgium",2019,"TV-MA","2 Seasons","Crime TV Shows, International TV Shows, TV Dramas","June","14",2019
"s3749",,"Guillermo Iv√°n, C√©sar Manjarrez, Estrella Sol√≠s, Liliana Moreno, Marco Uriel, Mario Zaragoza, Fernando Sarfatti, Jos√© √?ngel Bichir, Paty Blanco, P√≠a Sanz, Scarlet Gruber, Pakey V√°zquez, Ivonne Montero",,2019,"TV-MA","2 Seasons","Crime TV Shows, International TV Shows, Spanish-Language TV Shows","June","14",2019
"s3750",,"Lisa Edelstein, Beau Garrett, Necar Zadegan, Paul Adelstein, Janeane Garofalo, Alanna Ubach","United States",2019,"TV-MA","5 Seasons","TV Comedies, TV Dramas","June","14",2019
"s3751",,"Huma Qureshi, Siddharth, Rahul Khanna, Arif Zakaria, Seema Biswas, Sanjay Suri, Akash Khurana, Ashwath Bhatt, Anupam Bhattacharya, Adarsh Gourav","India",2019,"TV-MA","1 Season","British TV Shows, International TV Shows, TV Dramas","June","14",2019
"s3752",,"Marlon Wayans, Essence Atkins, Bresha Webb, Diallo Riddle, Notlim Taylor, Amir O'Neil","United States",2018,"TV-14","2 Seasons","TV Comedies","June","14",2019
"s3753",,"Krysten Ritter, David Tennant, Rachael Taylor, Mike Colter, Carrie-Anne Moss, Eka Darville, Erin Moriarty, Wil Traval, Susie Abromeit","United States",2019,"TV-MA","3 Seasons","Crime TV Shows, TV Action & Adventure, TV Dramas","June","14",2019
"s3755",,"Pablo Lyle, Ana Layevska, Leonardo Daniel, Javier D√≠az Due√±as, Daniel Mart√≠nez, Pamela Almanza, Roberto Bland√≥n, Sebasti√°n Ferrat, Gabriela Zamora, Mauricio Pimentel, Julio Casado, Eivaut Rischen","Mexico",2019,"TV-MA","1 Season","Crime TV Shows, International TV Shows, Spanish-Language TV Shows","June","14",2019
"s3756",,"Salma Malhas, Sultan Alkhail, Hamzeh Okab, Aysha Shahaltough, Zaid Zoubi, Ban Halaweh, Yasser Al Hadi","Jordan",2019,"TV-MA","1 Season","International TV Shows, TV Dramas, TV Mysteries","June","13",2019
"s3761",,"Nurfathiah Diaz","Malaysia",2011,"TV-Y","1 Season","Kids' TV","June","10",2019
"s3763",,"Kiefer Sutherland, Natascha McElhone, Maggie Q, Kal Penn, Adan Canto, Italia Ricci, LaMonica Garrett, Tanner Buchanan, Ben Lawson, Paulo Costanzo, Zoe McLellan","United States",2019,"TV-MA","3 Seasons","Crime TV Shows, TV Dramas, TV Thrillers","June","7",2019
"s3770",,"Erin Mathews, Kathleen Barr, Chiara Zanni, Rebecca Shoichet, Sabrina Pitre, Ingrid Nilson, Alessandro Juliani, Elyse Maloway, Vincent Tong","United States",2019,"TV-Y","1 Season","Kids' TV","June","7",2019
"s3771",,"Laura Linney, Ellen Page, Olympia Dukakis, Paul Gross, Murray Bartlett, Barbara Garrick, Charlie Barnett, Garcia, May Hong, Jen Richards, Victor Garber, Ashley Park, Christopher Larkin, Zosia Mamet, Molly Ringwald, Daniela Vega","United States",2019,"TV-MA","1 Season","TV Dramas","June","7",2019
"s3775",,"Jesse Plemons, Cristin Milioti, Jimmi Simpson, Rosemarie DeWitt, Douglas Hodge, Andrea Riseborough, Brenna Harding, Owen Teague, Andrew Gower, Kiran Sonia Sawar, Georgina Campbell, Joe Cole, Maxine Peake, Jake Davies, Clint Dyer, Letitia Wright, Babs Olusanmokun, Bryce Dallas Howard, Alice Eve, Michael Kelly, Cherry Jones, Gugu Mbatha-Raw, Mackenzie Davis, Wyatt Russell, Benedict Wong, Kelly Macdonald, Faye Marsay, Madeline Brewer, Hannah John-Kamen, Malachi Kirby, Alex Lawther, Jerome Flynn, James Norton, Rory Kinnear, Lindsay Duncan, Daniel Kaluuya, Jessica Brown Findlay, Rupert Everett, Toby Kebbell, Jodie Whittaker, Hayley Atwell, Domhnall Gleeson, Lenora Crichlow, Michael Smiley, Daniel Rigby, Chloe Pirrie, Jason Flemyng, Jon Hamm, Oona Chaplin, Rafe Spall","United Kingdom",2019,"TV-MA","5 Seasons","British TV Shows, International TV Shows, TV Dramas","June","5",2019
"s3779",,"Fred Armisen, Bill Hader, Helen Mirren","United States",2019,"TV-14","3 Seasons","TV Comedies","June","3",2019
"s3780",,"Ricardo Hurtado, Breanna Yde, Jackie R. Jacobson, Abby Donnelly, Alkoya Brunson, Jeremy Howard, JT Neal, Bryana Salaz, Ian Ziering, Camaron Engels","United States",2019,"TV-G","1 Season","Kids' TV, TV Action & Adventure, TV Comedies","June","3",2019
"s3781",,"Song Joong-ki, Jang Dong-gun, Kim Ji-won, Kim Ok-vin, Kim Eui-sung, Cho Seong-ha, Lee Do-gyeong, Park Hae-joon, Park Byung-eun","South Korea",2019,"TV-MA","1 Season","International TV Shows, Korean TV Shows, TV Action & Adventure","June","2",2019
"s3783",,"Cindy Lien, Nicholas Teo, Yao Ai-ning, Li Chung-lin, Chen Bor-jeng, Miao Ke-li","Taiwan",2019,"TV-14","1 Season","International TV Shows, TV Dramas","June","1",2019
"s3785",,"Kengo Kawanishi, Ai Kayano, Kana Hanazawa, Misaki Kuno, Nobuhiko Okamoto, Marina Inoue, Yoshimasa Hosoya, Shinichiro Miki, Tomokazu Sugita, Subaru Kimura, Shigeru Chiba, Toru Okawa, Takahiro Sakurai","Japan",2017,"TV-14","2 Seasons","Anime Series, International TV Shows, Teen TV Shows","June","1",2019
"s3788",,"Anthony LaPaglia, Kim Coates, Enrico Colantoni, Paul Sorvino, Maxim Roy, Brett Donahue, Michelle Mylett, Claudia Ferri, Tony Nappo","Canada",2019,"TV-MA","2 Seasons","Crime TV Shows, TV Dramas","May","31",2019
"s3790",,,,2019,"TV-MA","1 Season","Crime TV Shows, Docuseries, International TV Shows","May","31",2019
"s3793",,"Asante Blackk, Caleel Harris, Ethan Herisse, Jharrel Jerome, Marquis Rodriguez, Jovan Adepo, Chris Chalk, Justin Cunningham, Freddy Miyares, Michael Kenneth Williams, Marsha Stephanie Blake, Kylie Bunbury, Aunjanue Ellis, Vera Farmiga, Felicity Huffman, John Leguizamo, Niecy Nash","United States",2019,"TV-MA","1 Season","Crime TV Shows, TV Dramas","May","31",2019
"s3795",,"Jeff Ross, Bob Saget, James Adomian, Rachel Feinstein, Jerry Minor, Ayden Mayeri, Jaleel White, Natasha Leggero, Yamaneika Saunders, John Stamos, Nikki Glaser, Seth Green, Fortune Feimster, Jon Lovitz, Mindy Rickles, Gilbert Gottfried, Sasheer Zamata, Brandon T. Jackson, Ryan Phillippe, Ken Marino, Bridget Everett, John Gemberling, Leonardo Nam, Josh Homme","United States",2019,"TV-MA","1 Season","Stand-Up Comedy & Talk Shows, TV Comedies","May","27",2019
"s3797",,"Kazutoyo Koyabu",,2017,"TV-MA","1 Season","Docuseries, International TV Shows","May","24",2019
"s3800",,"DeWanda Wise, Cleo Anthony, Lyriq Bent, Anthony Ramos, Chyna Layne, Margot Bingham, Ilfanesh Hadera, Elvis Nolasco, De'Adre Aziza","United States",2018,"TV-MA","2 Seasons","Romantic TV Shows, TV Comedies, TV Dramas","May","24",2019
"s3802",,"Ren√©e Zellweger, Jane Levy, Blake Jenner, Keith Powers, Samantha Marie Ware, Juan Castano, Dave Annable, Saamer Usmani, Daniella Pineda, John Clarence Stewart, Louis Herthum","United States",2019,"TV-MA","1 Season","TV Dramas, TV Thrillers","May","24",2019
"s3807",,"Gavin Lewis, Theodore Barnes, Shelby Simmons, Cynthia Kaye McWilliams","United States",2019,"TV-G","2 Seasons","Kids' TV, TV Comedies","May","20",2019
"s3808",,"B√°rbara de Regil, Jos√© Mar√≠a de Tavira, Antonio Gaona, Hern√°n Mendoza, Vanessa Bauche, Christian Vasquez, Jos√© Sefami, Ariel L√≥pez Padilla","Mexico",2018,"TV-MA","2 Seasons","Crime TV Shows, International TV Shows, Spanish-Language TV Shows","May","20",2019
"s3809","DIEGO ENRIQUE OSORNO",,"Mexico",2019,"TV-MA","1 Season","Crime TV Shows, Docuseries, International TV Shows","May","17",2019
"s3813",,"Solvan ""Slick"" Naim, Rob Morgan, Shakira Barrera, Jade Eshete, Adriane Lenox, Donnell Rawlings, Eden Marryshow, Sam Eliad, Devale Ellis, J. Ray Acosta","United States",2019,"TV-MA","1 Season","TV Comedies","May","17",2019
"s3818",,"Ed Westwick, James Buckley, Joe Thomas, Lauren O'Rourke, Linzey Cocker, Nigel Lindsay, Lloyd Hutchinson, Lee Ross","United Kingdom",2019,"TV-MA","2 Seasons","British TV Shows, International TV Shows, TV Comedies","May","17",2019
"s3822",,"Freddie Fox, Kathryn Drysdale, Rasmus Hardiker, Joanna Ruiz, Ryan Sampson, Kelly Marie Stewart","United Kingdom",2017,"TV-Y","1 Season","British TV Shows, Kids' TV, TV Comedies","May","15",2019
"s3824",,"Chiara Francia, Mercedes Lambre, Victorio D'Alessandro, Mario Guerci, Florencia Ben√≠tez, Victoria Ramos","Argentina",2017,"TV-Y","1 Season","Kids' TV, Spanish-Language TV Shows","May","15",2019
"s3825",,"Riley Wang, Zhao Lusi, Zhang Jiongmin, Gratitude Dai, Yuan Hao",,2019,"TV-14","1 Season","International TV Shows, Romantic TV Shows, TV Dramas","May","15",2019
"s3827",,"Koki Uchiyama, Mikako Komatsu, Nobunaga Shimazaki, Rie Takahashi, Manaka Iwami, Soma Saito","Japan",2018,"TV-14","1 Season","Anime Series, International TV Shows","May","14",2019
"s3832",,"Kara Hui, Philip Keung, Benjamin Yuen, Sisley Choi, Hui Shiu Hung, Ben Wong, Joman Chiang","China, Hong Kong",2019,"TV-14","1 Season","Crime TV Shows, International TV Shows, TV Dramas","May","12",2019
"s3836",,"Aubrey Plaza, Judy Greer, Jane Adams, Zazie Beetz, Kate Berlant, Aya Cash, Michael Chernus, Kiersey Clemons, Orlando Bloom, Malin Akerman, Marc Maron, Dave Franco, Hannibal Buress, Jake Johnson, Emily Ratajkowski, Andrew Bachelor","United States",2019,"TV-MA","3 Seasons","TV Comedies, TV Dramas","May","10",2019
"s3838",,,,2019,"TV-MA","1 Season","Docuseries, Reality TV","May","10",2019
"s3839",,"Selton Mello, Caroline Abras, Enrique Diaz, Antonio Saboia, Lee Taylor, Otto Jr., Leonardo Medeiros, Osvaldo Mil, Jonathan Haagensen, Giulio Lopes, Susana Ribeiro","Brazil",2019,"TV-MA","2 Seasons","Crime TV Shows, International TV Shows, TV Dramas","May","10",2019
"s3840",,"Tiffany Tang, Luo Jin, Vanness Wu, Rachel Momo, Hsin Ai Lee","China",2016,"TV-14","1 Season","International TV Shows, Romantic TV Shows, TV Dramas","May","10",2019
"s3841",,"Kathryn Newton, Gideon Adlon, Sean Berdy, Natasha Liu Bordizzo, Jacques Colimon, Olivia DeJonge, Alex Fitzalan, Kristine Froseth, Jos√© Juli√°n, Alex MacNicoll, Toby Wallace, Rachel Keller","United States",2019,"TV-MA","1 Season","TV Dramas, Teen TV Shows","May","10",2019
"s3844",,"Li Yongzhen, Zhuang Kebi, Zhang Shunyuan, Wang Wei, Wen Shaoping, Liu Shumin, Lu Huiting, Ye Chengcheng, Chen Yuqi",,2015,"TV-PG","1 Season","International TV Shows, TV Dramas","May","8",2019
"s3845",,"Ungku Ismail, Fasha Sandha, Bell Ngasri, Wan Sharmila",,2016,"TV-PG","1 Season","International TV Shows, TV Comedies","May","8",2019
"s3846",,"Sherry Alhadad, Sharifah Amani, Fezrul Khan, Ungku Hariz, Ruzana Ibrahim, Zain Saidan, Cristina Suzanne, Safia Hanifah",,2016,"TV-14","1 Season","International TV Shows, Romantic TV Shows, TV Dramas","May","8",2019
"s3847",,"Raja Ilya, Nazim Othman, Zain Hamid, Ungku Ismail, Tunku Hanis",,2015,"TV-PG","1 Season","International TV Shows, Romantic TV Shows, TV Dramas","May","8",2019
"s3848",,"Mira Filzah, Ady Putra, Fadlan Hazim, Shima Anuar, Nazeera Sardi, Dian P. Ramlee, Wan Sharmila, Rosnah Johari, Idris Md Diah",,2015,"TV-14","1 Season","International TV Shows, Romantic TV Shows, TV Dramas","May","8",2019
"s3849",,"Nazim Othman, Johan As'ari, Nur Risteena, Niena Baharun",,2016,"TV-PG","1 Season","International TV Shows, TV Dramas","May","8",2019
"s3850",,"Jack Tan, Rain Shuaiyu, Rickman Chia, Orange Tan, Bernard Shen Jun, Kopi Lim Guo Wei, Dennis Gan",,2015,"TV-14","1 Season","International TV Shows, Romantic TV Shows, TV Comedies","May","8",2019
"s3851",,"Frederick Lee, Jojo Goh, Karena Teo, Jeffrey Cheng, Janelle Chin",,2016,"TV-PG","1 Season","International TV Shows, TV Dramas","May","8",2019
"s3852",,"Lenna Lim, Jack Tan, Rickman Chia, Rabbit Chen, Kopi Lim Guo Wei, Agnes Wang, Allan Toh, Mandy Chen, Tan Hau Yen",,2016,"TV-14","1 Season","International TV Shows, TV Dramas, TV Sci-Fi & Fantasy","May","8",2019
"s3853",,"Park Bo-young, Ahn Hyo-seop, Lee Sung-jae, Lee Si-eon, Han So-hee, Kwon Soo-hyun, Kim Sa-rang, Ahn Se-ha, Yun Yoo-sun","South Korea",2019,"TV-14","1 Season","Crime TV Shows, International TV Shows, Korean TV Shows","May","7",2019
"s3854",,"Souad Abdullah, Shujoon, Fatima Al Safi",,2019,"TV-14","1 Season","International TV Shows, TV Comedies, TV Dramas","May","7",2019
"s3855",,"Elham Al Fadalah, Ibrahim Al-Harbi, Khaled Al-Buraiki, Layla Abdullah, Noor Alghandour, Abeer Ahmad","Kuwait",2019,"TV-14","1 Season","International TV Shows, TV Dramas","May","7",2019
"s3856",,"Bassel Khayyat, Daniella Rahme, Nada Abou Farhat, Nicolas Daniel, Gabriel Yammine","Lebanon",2019,"TV-14","1 Season","Crime TV Shows, International TV Shows, TV Dramas","May","7",2019
"s3857",,"Monther Rayahnah, Khaled Ameen, Aseel Omran, Rawan Mahdi, Ali Al-Husseini, Abdullah Al-Turkumani",,2019,"TV-14","1 Season","International TV Shows, TV Dramas","May","7",2019
"s3861","FELIPE CANO","Sebasti√°n Osorio, Fabiana Medina, Laura Osma, Enrique Carriazo, Juli√°n Rom√°n, Juliana Vel√°squez, Juan Pablo Urrego, Carlos Vergara, Ernesto Campos, Fabio Rubiano, Ernesto Benjumea, Jairo Camargo, Marcela Agudelo","Mexico",2019,"TV-MA","1 Season","Crime TV Shows, International TV Shows, Spanish-Language TV Shows","May","3",2019
"s3862",,"Justin Collette, Mark Little, Kyle Dooley, Mark Forward, Joris Jarksy, Julie Lemieux, Kayla Lorette, Julie Sype","Canada, Brazil",2019,"TV-Y7","2 Seasons","Kids' TV, TV Comedies","May","3",2019
"s3865",,"Desiree Burch, Lloyd Griffith, Seann Walsh","United Kingdom",2019,"TV-PG","1 Season","Reality TV","May","3",2019
"s3868",,"Tiffany Haddish, Ali Wong, Steven Yeun, Nicole Byer, Richard E. Grant, Reggie Watts","United States",2019,"TV-MA","1 Season","TV Comedies","May","3",2019
"s3871",,"Jun Fukuyama, Takahiro Sakurai, Yukana, Ami Koshimizu, Kaori Nazuka, Fumiko Orikasa, Sayaka Ohara, Noriaki Sugiyama, Takahiro Mizushima, Soichiro Hoshi, Yuko Goto","Japan",2008,"TV-MA","2 Seasons","Anime Series, International TV Shows","May","1",2019
"s3877",,"Simon Lian, Teddy Chen, Sylvia Wang, Cosmos Lin, Ting Liu, Lucia Chen, Allie Ji, Sunnee Yang, Na Wei-hsun","Taiwan",2014,"TV-14","1 Season","International TV Shows, TV Action & Adventure, TV Comedies","April","30",2019
"s3879",,"Louis Cheung, Myolie Wu, Justin Cheung, Brian Chan, Raymond Chiu, Fish Liew, Lee Sheung Ching, Kaki Sham, Gregory Wong, Thor Lok","Hong Kong",2018,"TV-MA","1 Season","International TV Shows, TV Comedies, TV Dramas","April","30",2019
"s3880",,"Yoshiki Nakajima, Reina Ueda, Shigeo Kiyama, Tarusuke Shingaki, Kohsuke Toriumi, Kentaro Tone, Hiroo Sasaki, Megumi Ogata","Japan",2018,"TV-MA","1 Season","Anime Series, Crime TV Shows, International TV Shows","April","30",2019
"s3881",,"Jiro Wang, Pets Tseng, Sam Lin, Sylvia Wang, Wes Lo, Wayne Huang, Xu Ming-jie, Ba Yu, Emily Tsai, Chen Bo-zheng, Nylon Chen, Na Wei-hsun",,2013,"TV-14","1 Season","International TV Shows, TV Comedies, TV Dramas","April","30",2019
"s3882",,"George Hu, Chen De-xiu, Bo Yan, Lorene Ren, Tsai Yi-chen, Benjamin H. Wang, Wes Lo, Shao Xiang, Pets Tseng, Nylon Chen, Wu Xiong","Taiwan",2009,"TV-14","1 Season","International TV Shows, TV Comedies, TV Sci-Fi & Fantasy","April","30",2019
"s3883",,"Jiro Wang, Pets Tseng, Sam Lin, Xu Ming-jie, Sylvia Wang, Monkey Shao, Zhang Hao Ming, Na Wei-hsun",,2012,"TV-MA","1 Season","International TV Shows, TV Comedies, TV Dramas","April","30",2019
"s3884",,"Dylan Kuo, Ady An, Lan Cheng-Lung, Michael Chang, Joelle Lu","Taiwan",2004,"TV-MA","1 Season","Crime TV Shows, International TV Shows, Romantic TV Shows","April","30",2019
"s3885",,"Bruce Campbell, Lucy Lawless, Ray Santiago, Dana DeLorenzo, Jill Marie Jones","United States",2018,"TV-MA","3 Seasons","TV Action & Adventure, TV Comedies, TV Horror","April","29",2019
"s3887",,"Blanca Soto, Litzy, Dami√°n Alc√°zar, Marco P√©rez, Jorge Z√°rate, Rossana San Juan, Andr√©s Palacios, Rebecca Jones, Lincoln Palomeque","Mexico, United States",2018,"TV-MA","5 Seasons","Crime TV Shows, International TV Shows, Spanish-Language TV Shows","April","28",2019
"s3888",,"Sivan Alyra Rose, Uma Thurman, Tony Goldwyn, Marcus LaVoi, Nicholas Galitzine, Kyanna Simone Simpson, Griffin Powell-Arcand, Lilli Kay, Sarah Mezzanotte, Lilliya Scarlett Reid","United States",2019,"TV-MA","1 Season","TV Horror, TV Mysteries, Teen TV Shows","April","26",2019
"s3893",,,"United States",2019,"TV-PG","1 Season","Docuseries","April","26",2019
"s3894","QUENTIN TARANTINO","Samuel L. Jackson, Kurt Russell, Jennifer Jason Leigh, Walton Goggins, Demi√°n Bichir, Tim Roth, Michael Madsen, Bruce Dern, James Parks",,2015,"R","1 Season","TV Shows","April","25",2019
"s3898",,"Aaron Yan, Jiro Wang, Calvin Ka-Sing Chen, Danson Tang, Tsai Yi-chen, Alien Huang","Taiwan",2005,"TV-MA","1 Season","International TV Shows, TV Action & Adventure, TV Comedies","April","19",2019
"s3899",,"Chris Lilley","Australia",2019,"TV-MA","1 Season","International TV Shows, TV Comedies","April","19",2019
"s3901",,"Ruby Lin, Derek Chang, Lee Lee-zen, Archie Kao, Yen Yi-wen, Chu Chung-heng, Aaron Chen, Greg Han, Wen Chen-ling, Zhang Guang-chen","Taiwan",2017,"TV-MA","1 Season","International TV Shows, Romantic TV Shows","April","19",2019
"s3902",,"Mikako Tabe, Soki Matsumoto, Takayuki Yamada, Mai Kanazawa, Shigeru Sugimoto, Issei Takubo, Kanako Nishiyama, Yuzuha Kobayashi, Masako Matsuno, Kana Odaira, Hitoshi Honma, Ayano Kinashi","Japan, United States",2019,"TV-PG","1 Season","Anime Series, International TV Shows","April","19",2019
"s3903",,"Emmanuelle Ara√∫jo, Douglas Silva, Sabrina Nonata, Cau√£ Gon√ßalves, Daniel Furlan, Alice Braga, Alessandra Negrini, Lorena Comparato, Rodrigo Pandolfo, Luciana Vendramini, Maria Eduarda, Sidney Alexandre, Enzo Ovideo, Mauricio Xavier, Paulo Tiefenthaler, Ary Fran√ßa","Brazil",2019,"TV-MA","2 Seasons","International TV Shows, TV Comedies","April","19",2019
"s3921",,"Rachel Bloom, Vincent Rodriguez III, Santino Fontana, Donna Lynne Champlin, Pete Gardner, Vella Lovell, Gabrielle Ruiz, Scott Michael Foster","United States",2019,"TV-MA","4 Seasons","Romantic TV Shows, TV Comedies","April","13",2019
"s3926",,"Gad Elmaleh, Scott Keiji Takeda, Jordan Ver Hoeve, Erinn Hayes, Matthew Del Negro","United States",2019,"TV-MA","1 Season","TV Comedies","April","12",2019
"s3928",,"Zooey Deschanel, Jake Johnson, Max Greenfield, Hannah Simone, Lamorne Morris, Damon Wayans Jr.","United States",2018,"TV-14","7 Seasons","Romantic TV Shows, TV Comedies","April","11",2019
"s3929","LEE KYOUNGMI, YIM PILSUNG, JEON GO-WOON, KIM JONG-KWAN","Lee Ji-eun (IU), Bae Doona, Park Hae Soo, Kim Tae-hun, Shim Dal-gi, Lee Sung-wook, Jung Jun Won","South Korea",2019,"TV-MA","1 Season","International TV Shows, Korean TV Shows, TV Dramas","April","11",2019
"s3932",,"Bear Grylls","United States",2019,"TV-PG","1 Season","Kids' TV, Reality TV, Science & Nature TV","April","10",2019
"s3935",,,"United States",2017,"TV-MA","1 Season","Docuseries","April","7",2019
"s3937",,"Ricky Gervais, Kerry Godliman, Karl Pilkington, David Earl, Kay Noone, Tim Barlow, Arthur Nightingale, Sheila Collings, Margaret Towner, Barry Martin, Prem Modgil, Blanche Williams, Ninette Finch, Brett Goldstein, Ruth Bratt, Holli Dempsey","United Kingdom",2015,"TV-MA","3 Seasons","British TV Shows, International TV Shows, TV Comedies","April","5",2019
"s3938",,"Inbar Lavi, Rob Heaps, Parker Young, Marianne Rend√≥n, Stephen Bishop, Brian Benben, Katherine La Nasa","United States",2017,"TV-MA","2 Seasons","Crime TV Shows, International TV Shows, TV Comedies","April","5",2019
"s3939",,"David Attenborough","United States, United Kingdom",2019,"TV-PG","1 Season","Docuseries, Science & Nature TV","April","5",2019
"s3941",,"Hanna Ard√©hn, Felix Sandman, William Spetz, Ella Rappich, David Dencik, Reuben Sallmander, Maria Sundbom, Rebecka Hemse, Arvid Sand, Helena af Sandeberg, Anna Bj√∂rk","Sweden",2019,"TV-MA","1 Season","Crime TV Shows, International TV Shows, TV Dramas","April","5",2019
"s3942",,"Steven Tan, Iain McNally, Chi-Ren Choong, Kevin Adrian Barnaby, Tikriti Shabudin, Sherilyn Pang Li Ching, Azman Zulkiply","Malaysia",2017,"TV-PG","1 Season","Kids' TV","April","5",2019
"s3943",,"Sean Bean, Aaron Jakubenko, Edwin Wright, Mike Edward, Genevieve Aitken, John Bach, Tai Berdinner-Blades, Jared Turner, Andrew Foster, Calum Gittins, Shane Bartle, Ella Becroft, Lisa Chappell, Emma Fenton, Phil Brown, Carl Bland, Adam Gardiner","Canada, United States",2019,"TV-MA","3 Seasons","Docuseries","April","5",2019
"s3944",,"Amber Frank, Sydney Park, Bailey Gambertoglio, Darcy Rose Byrnes, Nolan North, Kari Wahlgren, Andy Pessoa, Tiya Sircar, Jonathan Craig WIlliams, Robert Knepper","United States",2019,"TV-Y7","8 Seasons","Kids' TV","April","5",2019
"s3945",,"Dami√°n Alc√°zar, Tamara Vallarta, Rolf Petersen, Claudette Maill√©, Tet√© Espinoza, Iv√°n Arag√≥n, Martha Claudia Moreno, Ed√©n Villavicencio, Carlos Corona, Giancarlo Ruiz, Mayra Batalla, Rodrigo Abed, Roberto Mateos, Anabel Ferreira, Roberto Sosa","Mexico",2019,"TV-MA","1 Season","Crime TV Shows, International TV Shows, Spanish-Language TV Shows","April","5",2019
"s3947",,"Song Sae-byeok, Go Joon-hee, Youn Jung-hoon, Jo Han-sun, Lee Won-jong, Park Gene-woo, Kwon Hyuk-hyun, Park Sang-min","South Korea",2019,"TV-MA","1 Season","Crime TV Shows, International TV Shows, Korean TV Shows","April","4",2019
"s3950",,"Bassel Khayyat, Daniella Rahme, Bassam Moughneih, Dana Mardini, Youssef Haddad, Talal Jarday, Sameera Barody","Lebanon",2018,"TV-14","1 Season","International TV Shows, Romantic TV Shows, TV Dramas","April","3",2019
"s3954",,,,2018,"TV-Y7","1 Season","Kids' TV, TV Comedies","April","1",2019
"s3957",,"Zo In-sung, Song Hye-kyo, Kim Bum, Jung Eun-ji, Bae Jong-ok, Young-hoon Kim","South Korea",2013,"TV-MA","1 Season","International TV Shows, Korean TV Shows, Romantic TV Shows","April","1",2019
"s3959",,"Ryohei Kimura, Takuya Eguchi, Megumi Han, Hideyuki Tanaka, Sumire Morohoshi, Ken Uo, Shigeru Ushiyama, Ryota Takeuchi, Eiji Hanawa, Hirokazu Sekido, Minoru Shiraishi, Kenjiro Tsuda, Hiroaki Hirata, Kaiji Soze","United States, Japan",2019,"TV-14","1 Season","Anime Series, International TV Shows","April","1",2019
"s3962",,"Jake Williamson, Rachael Dickson, Sumita Majumdar, Michael White, Tony Finnegan, Scott Mulligan, Rosie King","United Kingdom",2017,"TV-Y","1 Season","British TV Shows, Kids' TV","March","30",2019
