"show_id","director","cast","country","release_year","rating","duration","listed_in","date_added_month","date_added_day","date_added_year"
"s2",,"Ama Qamata, Khosi Ngema, Gail Mabalane, Thabang Molaba, Dillon Windvogel, Natasha Thahane, Arno Greeff, Xolile Tshabalala, Getmore Sithole, Cindy Mahlangu, Ryle De Morny, Greteli Fincham, Sello Maake Ka-Ncube, Odwa Gwanya, Mekaila Mathys, Sandi Schultz, Duane Williams, Shamilla Miller, Patrick Mofokeng","South Africa",2021,"TV-MA","2 Seasons","International TV Shows, TV Dramas, TV Mysteries","September","24",2021
"s3","JULIEN LECLERCQ","Sami Bouajila, Tracy Gotoas, Samuel Jouy, Nabiha Akkari, Sofia Lesaffre, Salim Kechiouche, Noureddine Farihi, Geert Van Rampelberg, Bakary Diombera",,2021,"TV-MA","1 Season","Crime TV Shows, International TV Shows, TV Action & Adventure","September","24",2021
"s4",,,,2021,"TV-MA","1 Season","Docuseries, Reality TV","September","24",2021
"s5",,"Mayur More, Jitendra Kumar, Ranjan Raj, Alam Khan, Ahsaas Channa, Revathi Pillai, Urvi Singh, Arun Kumar","India",2021,"TV-MA","2 Seasons","International TV Shows, Romantic TV Shows, TV Comedies","September","24",2021
"s6","MIKE FLANAGAN","Kate Siegel, Zach Gilford, Hamish Linklater, Henry Thomas, Kristin Lehman, Samantha Sloyan, Igby Rigney, Rahul Kohli, Annarah Cymone, Annabeth Gish, Alex Essoe, Rahul Abburi, Matt Biedel, Michael Trucco, Crystal Balint, Louis Oliver",,2021,"TV-MA","1 Season","TV Dramas, TV Horror, TV Mysteries","September","24",2021
"s9","ANDY DEVONSHIRE","Mel Giedroyc, Sue Perkins, Mary Berry, Paul Hollywood","United Kingdom",2021,"TV-14","9 Seasons","British TV Shows, Reality TV","September","24",2021
"s11",,,,2021,"TV-MA","1 Season","Crime TV Shows, Docuseries, International TV Shows","September","24",2021
"s12","KONGKIAT KOMESIRI","Sukollawat Kanarot, Sushar Manaying, Pavarit Mongkolpisit, Sahajak Boonthanakit, Suthipongse Thatphithakkul, Bhasaworn Bawronkirati, Daweerit Chullasapya, Waratthaya Wongchayaporn, Kittiphoom Wongpentak, Abhicha Thanachanun, Nophand Boonyai, Kittipong Khamsat, Arisara Wongchalee, Jaytiya Naiwattanakul, Pantipa Arunwattanachai, Panupan Jantanawong, Kungtap Saelim, Phumphat Chartsuriyakiat, Issara Veranitinunt, Keerati Sivakuae, Panjai Sirisuwan, Supranee Charoenpol, Suda Chuenban, Visaka Banhansupavat, Pitchatorn Santinatornkul",,2021,"TV-MA","1 Season","Crime TV Shows, International TV Shows, TV Action & Adventure","September","23",2021
"s15",,,,2021,"TV-MA","1 Season","British TV Shows, Crime TV Shows, Docuseries","September","22",2021
"s16",,"Logan Browning, Brandon P. Bell, DeRon Horton, Antoinette Robertson, John Patrick Amedori, Ashley Blaine Featherson, Marque Richardson, Giancarlo Esposito","United States",2021,"TV-MA","4 Seasons","TV Comedies, TV Dramas","September","22",2021
"s18",,"Luis Ernesto Franco, Camila Sodi, Sergio Goyri, Samadhi Zendejas, Eduardo Y√°√±ez, Sonya Smith, Alejandro Camacho, Azela Robinson, Uriel del Toro, G√©raldine Baz√°n, Gabriela Roel, Marcus Ornellas","Mexico",2020,"TV-MA","2 Seasons","Crime TV Shows, Spanish-Language TV Shows, TV Dramas","September","22",2021
"s20",,"Blanca Su√°rez, Iv√°n Marcos, √ìscar Casas, Adri√°n Lastra, Francesc Garrido, Stefan Weinert, Julia M√∂ller, Alicia Chojnowski",,2021,"TV-MA","1 Season","International TV Shows, Spanish-Language TV Shows, TV Action & Adventure","September","22",2021
"s21","OLIVIER MEGATON",,,2021,"TV-14","1 Season","Crime TV Shows, Docuseries, International TV Shows","September","22",2021
"s22",,"Engin Altan D√ºzyatan, Serdar G√∂khan, H√ºlya Darcan, Kaan Ta≈üaner, Esra Bilgi√ß, Osman Soykut, Serdar Deniz, Cengiz Co≈ükun, Reshad Strik, Hande Suba≈üƒ±","Turkey",2018,"TV-14","5 Seasons","International TV Shows, TV Action & Adventure, TV Dramas","September","22",2021
"s26",,"Brooke Satchwell","Australia",2021,"TV-14","2 Seasons","Docuseries, International TV Shows, Reality TV","September","21",2021
"s32",,"Lauren Ash, Rory O'Malley, RuPaul Charles, Jill Talley, Ike Barinholtz, Jon Barinholtz, Matthew Craig, Bob Odenkirk, Mike Hagerty, Katie Rich, Chris Witaske",,2021,"TV-MA","1 Season","TV Comedies","September","17",2021
"s33",,"Asa Butterfield, Gillian Anderson, Ncuti Gatwa, Emma Mackey, Connor Swindells, Kedar Williams-Stirling, Alistair Petrie","United Kingdom",2020,"TV-MA","3 Seasons","British TV Shows, International TV Shows, TV Comedies","September","17",2021
"s34",,"Lee Jung-jae, Park Hae-soo, Wi Ha-jun, Oh Young-soo, Jung Ho-yeon, Heo Sung-tae, Kim Joo-ryoung, Tripathi Anupam, You Seong-joo, Lee You-mi",,2021,"TV-MA","1 Season","International TV Shows, TV Dramas, TV Thrillers","September","17",2021
"s35",,"Dami Lee, Jason Lee, Bommie Catherine Han, Jennifer Waescher, Nancy Kim",,2020,"TV-Y7","1 Season","Kids' TV","September","17",2021
"s38",,"Antti P√§√§kk√∂nen, Helj√§ Heikkinen, Lynne Guaglione, Pasi Ruohonen, Rauno Ahonen","Finland",2018,"TV-Y7","1 Season","Kids' TV, TV Comedies","September","16",2021
"s40",,"Vatsal Dubey, Julie Tejwani, Rupa Bhimani, Jigna Bhardwaj, Rajesh Kava, Mousam, Swapnil","India",2021,"TV-Y7","3 Seasons","Kids' TV","September","16",2021
"s41",,"Yuri Lowenthal, Kimberly Brooks, Antony Del Rio, Trevor Devall, Ben Diskin, Grey Griffin, David Kaye, Tom Kenny, Judy Alice Lee, Roger Craig Smith, Fred Tatasciore","United States",2021,"TV-Y7","1 Season","Kids' TV, TV Sci-Fi & Fantasy","September","16",2021
"s48","BUNMI AJAKAIYE","Osas Ighodaro, Ini Dima-Okojie, Kemi Lala Akindoju, Toni Tones, Ebenezer Eno, Eso Okolocha DIke, Patrick Diabuah, Karibi Fubara, Temisan Emmanuel, Timini Egbuson",,2020,"TV-MA","1 Season","International TV Shows, Romantic TV Shows, TV Comedies","September","16",2021
"s50",,"Richard Mofe-Damijo, Dakore Akande, Bimbo Manuel, Blossom Chukwujekwu, Deyemi Okanlawon, Etim Effiong, Denola Grey, Duke Akintola, Eku Edewor, Ade Laoye, Anee Icha, Kevin Ushi, Jude Chukwuka, Amanda Afolabi","Nigeria",2021,"TV-MA","2 Seasons","International TV Shows, TV Dramas","September","15",2021
"s51",,"Kashmira Irani, Chandan Anand, Dinesh Mehta, Ankit Arora, Pushkar Goggiaa, Anjali Rana, Aarya DharmChand Kumar, Amit Behl, Maleeka Ghai","India",2014,"TV-PG","1 Season","International TV Shows, TV Dramas, TV Sci-Fi & Fantasy","September","15",2021
"s56",,"Nicole Byer, Jacques Torres","United States",2021,"TV-PG","6 Seasons","Reality TV","September","15",2021
"s66",,"Beth Chalmers, David Holt, Marcel McCalla, Teresa Gallagher","United Kingdom",2021,"TV-Y","6 Seasons","Kids' TV","September","15",2021
"s67",,,"India",2014,"TV-G","1 Season","Docuseries, International TV Shows","September","15",2021
"s68",,"Mark-Paul Gosselaar, Tiffani Thiessen, Mario Lopez, Lark Voorhies, Elizabeth Berkley, Dustin Diamond, Dennis Haskins","United States",1994,"TV-PG","9 Seasons","Kids' TV, TV Comedies","September","15",2021
"s70",,,"India",2015,"TV-PG","1 Season","International TV Shows, TV Dramas","September","15",2021
"s71",,"Itat√≠ Cantoral",,2021,"TV-MA","1 Season","International TV Shows, Reality TV, Romantic TV Shows","September","15",2021
"s73",,"Jack Whitehall, Michael Whitehall","United Kingdom",2021,"TV-MA","5 Seasons","British TV Shows, Docuseries, International TV Shows","September","14",2021
"s75",,,,2021,"TV-PG","2 Seasons","Reality TV","September","14",2021
"s77",,"Daiki Yamashita, Kohsuke Toriumi, Jun Fukushima, Hiroki Yasumoto, Showtaro Morikubo, Kentaro Ito, Daisuke Kishio, Yoshitsugu Matsuoka, Junichi Suwabe, Ayaka Suwa, Megumi Han, Tomoaki Maeno, Tsubasa Yonaga, Tetsuya Kakihara, Satoshi Hino, Hiroyuki Yoshino, Atsushi Abe, Koji Yusa, Kouki Miyata, Hiro Shimono, Wataru Hatano, Yuichi Nakamura, Kenji Nojima, Mamoru Miyano, Daisuke Ono, Yuma Uchida, Jun Fukuyama","Japan",2013,"TV-14","1 Season","Anime Series, International TV Shows","September","14",2021
"s83",,"Tom Ellis, Lauren German, Kevin Alejandro, D.B. Woodside, Lesley-Ann Brandt, Scarlett Estevez, Rachael Harris, Aimee Garcia, Tricia Helfer, Tom Welling, Jeremiah W. Birkett, Pej Vahdat, Michael Gladis","United States",2021,"TV-14","6 Seasons","Crime TV Shows, TV Comedies, TV Dramas","September","10",2021
"s84",,"Jo Koy",,2021,"TV-MA","1 Season","Reality TV","September","10",2021
"s86",,"Ikue Otani, Sarah Natochenny, Zeno Robinson, Cherami Leigh, James Carter Cathcart, Michele Knotz, Rodger Parsons, Ray Chase, Casey Mongillo, Tara Sands",,2021,"TV-Y7","1 Season","Anime Series, Kids' TV","September","10",2021
"s88",,"Jeon Hae-ri, Kim Eun-ah, Hong Bum-ki, Nam Do-hyeong, Um Sang-hyun",,2019,"TV-Y","2 Seasons","Kids' TV, Korean TV Shows","September","10",2021
"s90",,"Julie Tejwani, Sabina Malik, Jigna Bhardwaj, Rupa Bhimani, Lalit Agarwal, Rajesh Shukla, Rajesh Kava",,2017,"TV-Y7","4 Seasons","Kids' TV","September","9",2021
"s93",,"Pauline Etienne, Laurent Capelluto, Stefano Cassetti, Mehmet Kurtulu≈ü, Babetida Sadjo, Jan Bijvoet, Ksawery Szlenkier, Vincent Londez, Regina Bikkinina, Alba Ga√Øa Kraghede Bellugi, Nabil Mallat","Belgium",2021,"TV-MA","2 Seasons","International TV Shows, TV Dramas, TV Mysteries","September","8",2021
"s96",,"Michelle Buteau","United States, United Kingdom",2021,"TV-MA","3 Seasons","Reality TV","September","8",2021
"s98",,"Jack Fisher, Tom Kenny, Amanda C. Miller, Kim Yarbrough, Keith Ferguson, Grey Griffin, Lily Rose Silver","United States",2021,"TV-Y7","2 Seasons","Kids' TV, TV Comedies, TV Sci-Fi & Fantasy","September","7",2021
"s99",,"Antonio Aakeel, Chipo Chung, Simon Foster, Teresa Gallagher, Simon Greenall, Kate Harbour, Paul Panting, Rob Rackstraw, William Vanderpuye, Helen Walsh, Keith Wickham, Andres Williams, Jo Wyatt","United Kingdom",2021,"TV-Y","1 Season","British TV Shows, Kids' TV","September","7",2021
"s100",,"Julie Delpy, Elisabeth Shue, Sarah Jones, Alexia Landeau, Mathieu Demy, Troy Garity, Timm Sharp, Giovanni Ribisi","France, United States",2021,"TV-MA","1 Season","TV Comedies, TV Dramas","September","7",2021
"s101",,"Austin Abell, Travis Turner, Cole Howard, Anna Cummer, Jesse Inocalla, Brian Dobson, Michael Adamthwaite, Joseph Girgis, Caitlyn Bairstow",,2019,"TV-Y7","2 Seasons","Kids' TV","September","7",2021
"s103","JASON HEHIR",,,2021,"TV-14","1 Season","Docuseries, Science & Nature TV","September","6",2021
"s105",,"Robyn Slade, Kami Desilets","South Korea",2016,"TV-Y","2 Seasons","Kids' TV, Korean TV Shows","September","6",2021
"s107",,"Peyton List, Karan Brar, Skai Jackson, Miranda May, Kevin G. Quinn, Nathan Arenas, Nina Lu","United States",2021,"TV-G","5 Seasons","Kids' TV, TV Comedies","September","5",2021
"s109",,"Aubri Ibrag, Sana'a Shaik, Miah Madden, Mercy Cornwall, Georgia-May Davis, Ryan Harrison, Josh Heuston, Alexander Grant","Australia",2021,"TV-G","1 Season","Kids' TV, TV Dramas, Teen TV Shows","September","3",2021
"s110",,"√örsula Corber√≥, Itziar Itu√±o, √?lvaro Morte, Paco Tous, Enrique Arce, Pedro Alonso, Mar√≠a Pedraza, Alba Flores, Miguel Herr√°n, Jaime Lorente, Esther Acebo, Darko Peric, Kiti M√°nver","Spain",2021,"TV-MA","5 Seasons","Crime TV Shows, International TV Shows, Spanish-Language TV Shows","September","3",2021
"s111","LUIS ALFARO, JAVIER G√≥MEZ SANTANDER",,,2021,"TV-MA","1 Season","Docuseries, International TV Shows, Spanish-Language TV Shows","September","3",2021
"s112",,"Liam Mitchell, Dee Bradley Baker, Grey Griffin, Josh McDermitt, Kari Wahlgren, Judy Alice Lee, Ali Mawji","United States, Singapore",2021,"TV-Y","1 Season","Kids' TV","September","3",2021
"s121",,"Jon Allen, Kellen Goff, Joe Hernandez, Kaiji Tang","Australia",2021,"TV-Y7","1 Season","Kids' TV, TV Comedies","September","2",2021
"s122",,"Lee Ji-eun, Yeo Jin-goo, Shin Jung-geun, Seo Yi-sook, Bae Hae-sun, Pyo Ji-hoon, Cho Hyun-chul, Kang Hong-suk, Lee Do-hyun, Lee Tae-seon, Kang Mina, Park You-na, Oh Ji-ho",,2019,"TV-14","1 Season","International TV Shows, Romantic TV Shows, TV Comedies","September","2",2021
"s124",,,,2012,"TV-Y7","1 Season","Kids' TV","September","2",2021
"s125",,,"South Korea",2013,"TV-Y7","3 Seasons","Kids' TV, Korean TV Shows","September","2",2021
"s126",,"Sean Hayes, Wanda Sykes, Laurie Metcalf, David Harbour, Gary Cole, Patti Harrison, Matt Rogers","United States",2021,"TV-MA","1 Season","Crime TV Shows, TV Action & Adventure, TV Comedies","September","2",2021
"s133",,"Tseng Yun-fan, Kao Yun-shuo, Chiang Ching-yen, Meng Ching-fu, Huang Bai-wei, Ma Kuo-yao, Chen Yen-chun, Sun Ke-fang, Kai Yang-niu, Chen Yu-wen, Nick Liao, Lin Kai-ling, Mickey Huang, Liu Kuan-ting, Jiang Du-hui",,2021,"TV-MA","1 Season","International TV Shows, TV Action & Adventure, TV Comedies","September","1",2021
"s148",,,,2021,"TV-PG","1 Season","Reality TV","September","1",2021
"s149","GERHARD MOSTERT","Hakeem Kae-Kazim, Chioma Omeruah, Orukotan Adejola, Flora Chiedo, Emeka Nwagbaraocha, Anthony Oseyemi, Oluwabukola Thomas, Soibifaa Dokubo",,2020,"TV-14","1 Season","TV Shows","September","1",2021
"s154",,"Lori Gardner, Kate Bristol, Billy Bob Thompson, Marc Thompson, Erica Schroeder","Russia",2016,"TV-Y","2 Seasons","Kids' TV","September","1",2021
"s155",,"Kensho Ono, Yuki Ono, Chiwa Saito, Yoshimasa Hosoya, Hirofumi Nojima, Kenji Hamada, Takuya Eguchi, Soichiro Hoshi, Tatsuhisa Suzuki, Go Inoue, Daisuke Ono, Ryohei Kimura, Junichi Suwabe, Kazuya Nakai, Fumiko Orikasa, Kenichi Suzumura, Kisho Taniyama, Hiroshi Kamiya","Japan",2015,"TV-MA","3 Seasons","Anime Series, International TV Shows, Teen TV Shows","September","1",2021
"s161",,"Gerald McRaney, Shanna Reed, Nicole Dubuc, Chelsea Hertford, Marisa Ryan, Matt Mulhern, Beverly Archer, Jon Cypher","United States",1992,"TV-PG","4 Seasons","TV Comedies","September","1",2021
"s166",,"Patricio Contreras, Alejandro Goic, Sergio Hern√°ndez, Mariana Loyola Ruz, Alejandro Trejo, Daniel Alca√≠no Cuevas, Nicol√°s Poblete, Susana Hidalgo, Gloria M√ºnchmeyer",,2019,"TV-MA","1 Season","Crime TV Shows, International TV Shows, Spanish-Language TV Shows","September","1",2021
"s182",,,,2021,"TV-14","1 Season","Docuseries","September","1",2021
"s185",,"Marie Kondo","United States",2021,"TV-PG","1 Season","Reality TV","August","31",2021
"s187",,"Shin Min-a, Kim Seon-ho, Lee Sang-yi, Gong Min-jeung, Kim Young-ok, Cho Han-cheul, In Gyo-jin, Lee Bong-ryeon, Cha Cheong-hwa, Kang Hyung-suk",,2021,"TV-14","1 Season","International TV Shows, Romantic TV Shows, TV Comedies","August","29",2021
"s188",,"Kenjiro Tsuda",,2021,"TV-G","1 Season","International TV Shows, TV Comedies","August","29",2021
"s190",,"Um Sang-hyun, Park Yoon-hee, Kang Shi-hyun, Hong Bum-ki, Kim Hyun-wook, Lee In-suk, Song Ha-rim",,2020,"TV-Y","2 Seasons","Kids' TV, TV Comedies","August","28",2021
"s194",,"Jung Hae-in, Koo Kyo-hwan, Kim Sung-kyun, Son Suk-ku",", South Korea",2021,"TV-MA","1 Season","International TV Shows, TV Dramas","August","27",2021
"s195",,"Frank Ramirez, Patricia Casta√±eda, Chela del R√≠o, Patrick Delmas, Mar√≠a Jos√© Mart√≠nez, Robinson D√≠az, Juan √?ngel, Guillermo Olarte, Constanza Duque, Marcela Carvajal",,2002,"TV-MA","1 Season","International TV Shows, Spanish-Language TV Shows, TV Dramas","August","27",2021
"s198",,"Michael J. Woodard, Mary Lambert, Jonathan Van Ness, Haley Tju, Brett Gelman, Tony Hale, Vincent Rodriguez III, Annie Potts, Jessica Williams, Melissa Villase√±or, Cathy Vu, Jennifer Coolidge, Flea",,2021,"TV-Y7","1 Season","Kids' TV, TV Comedies","August","27",2021
"s199","KEMI ADETIBA","Sola Sobowale, Toni Tones, Richard Mofe-Damijo, Efa Iwara, Titi Kuti, Tobechukwu ""iLLbliss"" Ejiofor, Remilekun ""Reminisce"" Safaru, Charles  ""Charly Boy"" Oputa, Nse Ikpe-Etim, Keppy Ekpenyong Bassey, Bimbo Manuel, Akin Lewis, Lord Frank, Osas Ighodaro, Taiwo Ajai-Lycett, Paul Sambo","Nigeria",2021,"TV-MA","1 Season","Crime TV Shows, International TV Shows, TV Dramas","August","27",2021
"s213",,"Charlie Murphy, Ruth Bradley, Sarah Greene, Brian Gleeson, Michelle Fairley, Ian McElhinney, Michael Ford-FitzGerald, Paul Reid, Barry Ward, Tom Turner, Perdita Weeks, Andrew Simpson, Sophie Robinson","Ireland",2016,"TV-MA","2 Seasons","International TV Shows, TV Dramas","August","27",2021
"s214",,"King & Prince, Hey! Say! JUMP, KAT-TUN, NEWS, Kansai Johnny's Jr., Snow Man, Tomoyuki Yara, Travis Japan, Bi shonen, SixTONES, HiHi Jets, Kis-My-Ft2, Koichi Domoto",,2021,"TV-PG","3 Seasons","Docuseries, International TV Shows","August","27",2021
"s219",,,,2021,"TV-14","1 Season","Reality TV, Teen TV Shows","August","27",2021
"s220",,"Takuma Terashima, Mikako Komatsu, Rie Kugimiya, Hiromichi Tezuka, Shiori Izawa, Shiki Aoki, Sayaka Ohara, Hochu Otsuka, Kikuko Inoue","Japan",2021,"TV-14","1 Season","Anime Series, International TV Shows","August","26",2021
"s221",,"Loretta Devine, Tia Mowry-Hardrict, Anthony Alabi, Talia Jackson, Isaiah Russell-Bailey, Cameron J. Wright, Jordyn Raya James, Richard Roundtree","United States",2021,"TV-PG","4 Seasons","Kids' TV, TV Comedies","August","26",2021
"s223","BRAD ANDERSON","Zoe Kazan, Betty Gabriel, Adrian Grenier, Phoenix Raei, Abraham Lim, Jessica Collins, Camaron Engels, Jaylin Fletcher, Liz Alexander, Joyce Guy, Daniel Henshall, Ian Meadows, Jamie Timony, Steve Mouzakis, Becca Lish",,2021,"TV-MA","1 Season","Crime TV Shows, TV Dramas, TV Mysteries","August","25",2021
"s224","MAURICIO DIAS, TATIANA VILLELA",,,2021,"TV-MA","1 Season","Crime TV Shows, Docuseries, International TV Shows","August","25",2021
"s225",,,,2021,"TV-14","1 Season","International TV Shows, Reality TV","August","25",2021
"s226",,"Maria Wawreniuk, Ignacy Liss, Micha≈Ç Sikorski, Wojciech Dolatowski, Klaudia Ko≈õcista, Zuzanna Galewicz, Marta Nieradkiewicz, Sara Celler Jezierska, Pola Kr√≥l, Marcin Czarnik, Martyna Nowakowska",,2021,"TV-MA","1 Season","International TV Shows, TV Dramas, TV Mysteries","August","25",2021
"s227",,"Kathrine Thorborg Johansen, Elias Holmen S√∏rensen, Andr√© S√∏rum, Kim Fairchild, Sara Khorami, Terje Str√∏mdahl, √òystein R√∏ger, Marianne Jonger, Martin Karelius",,2021,"TV-MA","1 Season","International TV Shows, TV Comedies, TV Dramas","August","25",2021
"s233",,"Pat Sajak, Vanna White","United States",2019,"TV-G","3 Seasons","Reality TV","August","25",2021
"s235",,,,2021,"TV-Y","1 Season","Kids' TV, TV Comedies","August","24",2021
"s242",,"Melissa Roxburgh, Josh Dallas, Athena Karkanis, J.R. Ramirez, Luna Blaise, Jack Messina, Parveen Kaur","United States",2021,"TV-14","3 Seasons","TV Dramas, TV Mysteries, TV Sci-Fi & Fantasy","August","21",2021
"s243",,,,2021,"TV-MA","1 Season","International TV Shows, TV Comedies","August","20",2021
"s244",,"Luc√≠a Uribe, Flavio Medina, Isabella Vazquez Morales, Pierre Louis, Mercedes Hern√°ndez",,2021,"TV-MA","1 Season","International TV Shows, Spanish-Language TV Shows, TV Comedies","August","20",2021
"s246",,"Paik Jong-won",,2021,"TV-PG","1 Season","Docuseries, International TV Shows","August","20",2021
"s249",,"Sandra Oh, Jay Duplass, Holland Taylor, David Morse, Bob Balaban, Nana Mensah, Everly Carganilla",,2021,"TV-MA","1 Season","TV Comedies, TV Dramas","August","20",2021
"s255",,"Alan C. Lim, Paul Killam, Maisie Benson, Kerry Gudjohnsen, Smith Foreman, Neena-Sinaii Simpo, Eli Morse, Adelaide Hirasaki, Jim Capobianco, Anna Chambers, Pfifer Chastain","United States",2021,"TV-Y","5 Seasons","Kids' TV","August","18",2021
"s261",,"Taylor Kitsch, Nina Hoss, Logan Marshall-Green, Michael C. Hall, Tuppence Middleton, Mala Emde, Maximilian Ehrenreich, Sebastian Koch, Anne Ratte-Polle, Lena D√∂rrie, Benjamin Sadler",,2020,"TV-MA","1 Season","Crime TV Shows, International TV Shows, TV Dramas","August","18",2021
"s264",,,"United States",2016,"TV-Y","2 Seasons","Kids' TV","August","16",2021
"s266",,"Kaito Ishikawa, Asami Seto, Nao Toyama, Atsumi Tanezaki, Maaya Uchida, Yurika Kubo, Inori Minase","Japan",2018,"TV-14","1 Season","Anime Series, International TV Shows, Romantic TV Shows","August","15",2021
"s267",,,"India",2020,"TV-MA","1 Season","Docuseries, International TV Shows","August","15",2021
"s270",,"Liza Jacqueline, Helena Evangeliou, Lisa Ortiz, Kerry Williams, Gregory Abbey, Dan Green, Michael Sinterniklaas, Suzy Myers, Christina Rodriguez, Dani Schaffel, Sebastian Arcelus, Rachael Lillis","Italy",2015,"TV-Y7","2 Seasons","Kids' TV","August","15",2021
"s272",,"Rosa Salazar, Eric Lange, Catherine Keener, Jeff Ward, Manny Jacinto, Hannah Levien, Patrick Fischler","United States",2021,"TV-MA","1 Season","TV Dramas, TV Horror, TV Mysteries","August","13",2021
"s273",,"Tyler Posey, Charlet Chung, Jorge Diaz, Camille Ramsey, Luke Youngblood, Ren√©e Elise Goldsberry","United States",2021,"TV-Y7","5 Seasons","Kids' TV","August","13",2021
"s274","JUAN CARLOS MEDINA","Finnegan Oldfield, Nicolas Duvauchelle, Guillaume Gouix, Garance Marillier, Nailia Harzoune","France",2021,"TV-MA","1 Season","Crime TV Shows, International TV Shows, TV Dramas","August","13",2021
"s275",,"Jane Fonda, Lily Tomlin, Martin Sheen, Sam Waterston, June Diane Raphael, Brooklyn Decker, Ethan Embry, Baron Vaughn","United States",2021,"TV-MA","7 Seasons","TV Comedies, TV Dramas","August","13",2021
"s276",,"Chino Dar√≠n, Nancy Dupl√°a, Joaqu√≠n Furriel, Peter Lanzani, Mercedes Mor√°n, Diego Peretti, Vera Spinetta, Nico Garc√≠a Hume, Victoria Almeida, Santiago Korovsky, Patricio Aramburu, Alfonso Tort, Diego Gentile, N√©stor Guzzini, Daniel Kuzniecka","Argentina",2021,"TV-MA","1 Season","Crime TV Shows, International TV Shows, Spanish-Language TV Shows","August","13",2021
"s277","INMA TORRENTE","Diana G√≥mez, Silma L√≥pez, Paula Malia, Teresa Riott, Maxi Iglesias, Ibrahim Al Shami","Spain",2021,"TV-MA","2 Seasons","International TV Shows, Romantic TV Shows, Spanish-Language TV Shows","August","13",2021
"s278",,"Andria Tayeh, Rakeen Sa'ad, Noor Taher, Yara Mustafa, Joanna Arida, Salsabiela, Nadera Emran, Reem Saadeh","Jordan",2021,"TV-14","1 Season","International TV Shows, TV Dramas, Teen TV Shows","August","12",2021
"s281",,,"United States",2021,"TV-PG","1 Season","Reality TV","August","11",2021
"s287",,"Laila Lockhart Kraner, Tucker Chandler, Juliet Donenfeld, Maggi Lowe, Donovan Patton, Eduardo Franco, Tara Strong, Secunda Wood, Carla Tassara, Sainty Nelsen","United States",2021,"TV-Y","2 Seasons","Kids' TV","August","10",2021
"s288","SAKON TIACHAROEN","Khemanit Jamikorn, Thitipoom Techaapaikhun, Kannaporn Puangthong, Premmanat Suwannanon, Mintita Wattanakul, Thames Sanpakit, Katareeya Theapchatri, Phanuroj Chalermkijporntavee, Jirapisit Jaravijit",,2021,"TV-14","1 Season","International TV Shows, Romantic TV Shows, TV Comedies","August","10",2021
"s289",,"Amparo Grisales, Fernando Sol√≥rzano, Angelica Blandon, Katherine Escobar, Yuly Ferreira, Alejandra Sandoval, Andrea G√≥mez, Andrea Guzm√°n, Diego V√°squez, Juli√°n Rom√°n, Juan Pablo Franco","Colombia",2018,"TV-MA","1 Season","Crime TV Shows, International TV Shows, Spanish-Language TV Shows","August","10",2021
"s290",,"Yeo Jin-goo, Lee Se-young, Kim Sang-kyung, Jung Hye-young, Jang Kwang, Kwon Hae-hyo, Jang Yeong-nam, Lee Kyu-han","South Korea",2019,"TV-14","1 Season","International TV Shows, Romantic TV Shows, TV Dramas","August","10",2021
"s292",,"Yoko Hikasa, Katsuyuki Konishi, Megumi Hayashibara, Inuko Inuyama, Romi Park, Kosuke Takaguchi, Masahiko Tanaka, Wataru Takagi, Yuji Ueda, Megumi Nakajima, Takehito Koyasu, Yoko Soumi, Motoko Kumai, Yui Horie, Yuichi Nakamura, Nana Mizuki, Takumu Miyazono, Noriaki Kanze, Michiko Neya, Toru Sakurai, Rina Hidaka, Masakazu Morita, Minami Takayama","Japan",2021,"TV-14","1 Season","Anime Series, International TV Shows","August","9",2021
"s297",,"Lior Raz, Kaelen Ohm, Sanaa Lathan, Moran Rosenblatt, Lior Ashkenazi, Gregg Henry, Gal Toren","Israel, United States",2021,"TV-MA","1 Season","TV Action & Adventure, TV Dramas, TV Mysteries","August","6",2021
"s298","BEJOY NAMBIAR, PRIYADARSHAN, KARTHIK NARAIN, VASANTH SAI, KARTHIK SUBBARAJ, ARVIND SWAMY, RATHINDRAN R PRASAD, SARJUN, GAUTHAM VASUDEV MENON","Suriya, Vijay Sethupathi, Revathy, Prakash Raj, Siddarth, Parvathy, Delhi Ganesh, Gautham Vasudev Menon, Anjali, Yogi Babu, Aditi Balan, Remya Nambeesan, Poorna, Prayaga Martin, Rythvika Suriya, Arvind Swamy, Prasanna, Atharva, Bobby Simha, Ashok Selvan, Nedumudi Venu, Kishore","India",2021,"TV-MA","1 Season","TV Shows","August","6",2021
"s310",,"Mark Towle, Shawn Pilot, Constance Nunes, Tony Quinones, Mike ""Caveman"" Pyle",,2021,"TV-PG","3 Seasons","Reality TV","August","4",2021
"s311","BILLY CORBEN",,"United States",2021,"TV-MA","1 Season","Crime TV Shows, Docuseries","August","4",2021
"s312",,"Ana Valeria Becerril, Michael Ronda, Yankel Stevan, Zion Moreno, Luis Curiel, Samantha Acu√±a, Macarena Garc√≠a, Fiona Palomo, Andr√©s Baida, Patricio Gallardo, Iv√°n Arag√≥n, Xabiani Ponce de Le√≥n, Patricia Maqueo, Rodrigo Cachero, Roc√≠o Verdejo, Mauro S√°nchez Navarro, Lidia San Jos√©, Thanya L√≥pez, Renata del Castillo, Arturo Barba, Kariam Castro, Ariana Saavedra, Alexander Holtmann, Nastassia Villasana, Marco Zunino","Mexico",2021,"TV-MA","2 Seasons","International TV Shows, Spanish-Language TV Shows, TV Dramas","August","4",2021
"s313",,"Paris Hilton","United States",2021,"TV-MA","1 Season","Reality TV","August","4",2021
"s314",,"Ady An, Vanness Wu, Ann Hsu, Wu Kang-ren, Xiao Xiao Bin","Taiwan",2009,"TV-14","1 Season","International TV Shows, Romantic TV Shows, TV Dramas","August","3",2021
"s317","HSU FU-CHUN","Roy Chiu, Alice Ko, Tia Lee, Patrick Lee, Kuo Shu-yao, James Wen, Janel Tsai","Taiwan",2011,"TV-14","1 Season","International TV Shows, Romantic TV Shows, TV Comedies","August","3",2021
"s320",,"Joe Chen, Ming Dao, Sam Wang, Joyce Chao, Gino, Su Li-hsin, Wang Chuan, Ehlo Huang","Taiwan",2005,"TV-14","1 Season","International TV Shows, Romantic TV Shows, TV Comedies","August","3",2021
"s321",,,,2021,"TV-PG","1 Season","Docuseries","August","3",2021
