"show_id","director","cast","country","release_year","rating","duration","listed_in","date_added_month","date_added_day","date_added_year"
"s5355",,"Rainie Yang, Yan Yu-lin, Johnny Lu, Chang Fu-chien, Chen Chi-hsia","Taiwan",2016,"TV-PG","1 Season","International TV Shows, Romantic TV Shows, TV Dramas","August","1",2017
"s5356",,"Pyotr Fyodorov, Paulina Andreeva, Dmitry Shevchenko, Aleksey Gorbunov, Evgeniya Dmitrieva, Maksim Pinsker","Russia",2014,"TV-MA","1 Season","Crime TV Shows, International TV Shows, Romantic TV Shows","August","1",2017
"s5357",,"Chris Wu, Chen Yu, Greg Han, Esther Yeh, Yeh Chen-Ting, Deng Yu-kai",,2016,"TV-14","1 Season","International TV Shows, Romantic TV Shows, TV Comedies","August","1",2017
"s5361",,"Juan Pablo Urrego, Amparo Grisales, Nicole Santamar√≠a, Elkin D√≠az, Francisco Javier Rueda, Rams√©s Ramos, Lina Marcela Castrill√≥n, Toto Vega, Camilo S√°enz, Mijail Mulkay, Natasha Klauss, Nelson Camayo",,2017,"TV-MA","1 Season","Crime TV Shows, International TV Shows, Spanish-Language TV Shows","August","1",2017
"s5363",,"Louise Lee, Rui En, Pierre Png, Darren Lim, Cynthia Koh, Belinda Lee","Singapore",2011,"TV-14","1 Season","International TV Shows, TV Dramas","August","1",2017
"s5364",,"Chris O'Dowd, Richard Ayoade, Katherine Parkinson, Matt Berry","United Kingdom",2013,"TV-MA","5 Seasons","British TV Shows, Classic & Cult TV, International TV Shows","August","1",2017
"s5366",,"Toby Stephens, Miranda Raison, Lucy Punch, Nick Dunning, Rory Kinnear, Ronny Jhutti, Roger Griffiths, Patrick Baladi","United Kingdom",2012,"TV-MA","2 Seasons","British TV Shows, Crime TV Shows, International TV Shows","August","1",2017
"s5367",,"Robert Powell","United Kingdom",2009,"TV-MA","1 Season","British TV Shows, Docuseries, International TV Shows","August","1",2017
"s5368","VANESSA ROTH",,"United States",2017,"TV-14","1 Season","Docuseries","July","28",2017
"s5373","ERIC ABRAMS","Ari Shaffir","United States",2017,"TV-MA","1 Season","Stand-Up Comedy & Talk Shows","July","18",2017
"s5381",,"Stephanie Lemelin, A.J. LoCascio, Dan Milano, Grey DeLisle, Cree Summer, Laraine Newman, Chris Parnell, Ana Gasteyer, Dee Bradley Baker, Thomas Lennon, Dominic Catrambone","United States",2017,"TV-Y7","4 Seasons","Kids' TV","July","7",2017
"s5382","STEFAN BROGREN","Amanda Arcuri, Amir Bageria, Soma Bhatia, Jamie Bloch, Stefan Brogren, Chelsea Clark, Reiya Downs, Ana Golja, Nikki Gould, Ricardo Hoyos, Ehren Kassam, Andre Kim, Lyle Lettau, Spencer MacPherson, Eric Osborne, Dante Scott, Olivia Scriven, Sara Waisglass, Richard Walters","Canada",2017,"TV-14","4 Seasons","International TV Shows, TV Dramas, Teen TV Shows","July","7",2017
"s5383",,"Rain, Tiffany Tang, Luo Jin, Dilraba Dilmurat, Yao Yichen","China",2015,"TV-PG","1 Season","International TV Shows, Romantic TV Shows, TV Dramas","July","7",2017
"s5384",,"Chen Daoming, Peter Ho, Duan Yihong, Qin Lan, Li Yixiao, Yang Lixin, You Yong, Yu Hewei","China",2012,"TV-14","1 Season","International TV Shows, TV Dramas","July","7",2017
"s5385",,"Fu Dalong, Ning Jing, Yu Entai, Zhou Bo, Fu Miao, Feihu Sun, Lu Ying, Qiu Yongli","China",2012,"TV-14","1 Season","International TV Shows, TV Dramas","July","7",2017
"s5387",,"Danny Chan, Michelle Lang, Ted Duran, Hazen MacIntyre, Luoyong Wang, Natalia Dzyublo, Traci Ann Wolfe, Ke Gai, Zhou Zhou, Yu Chenghui","China",2008,"TV-14","1 Season","International TV Shows, TV Action & Adventure, TV Dramas","July","7",2017
"s5389","SERDAR AKAR","Erdal Be≈üik√ßioƒülu, Yasemin Allen, Melis Birkan, Saygƒ±n Soysal, Berkan ≈ûal, Metin Belgin, Ay√ßa Eren, Selin Uludoƒüan, √ñzay Fecht, Suna Yƒ±ldƒ±zoƒülu","Turkey",2016,"TV-MA","1 Season","International TV Shows, TV Dramas, TV Mysteries","July","1",2017
"s5391",,"Christopher Lee, Rui En, Desmond Tan, Zheng Geping, Zhang Zhenhuan, Paige Chua, Xu Bin, Carrie Wong","Singapore",2014,"TV-14","1 Season","Crime TV Shows, International TV Shows, TV Dramas","July","1",2017
"s5393",,"Kate Higgins, Sean Hankinson, Haviland Stillwell, Paula Rhodes, Charlie Bodin, Laura Gerow, Katie Crown, Nakia Burrise, Tara Sands, Ashlyn Selich","United States, Canada",2012,"TV-Y","1 Season","Kids' TV, TV Comedies","July","1",2017
"s5394",,"Jeanette Aw, Elvin Ng, Zhou Ying, Christopher Lee, Dai Xiangyu, Guo Liang",,2010,"TV-14","1 Season","International TV Shows, TV Dramas","July","1",2017
"s5396",,"ƒ∞brahim √áelikkol, Bel√ßim Bilgin, Alican Y√ºcesoy, Teoman Kumbaracƒ±ba≈üƒ±, Serdar Yeƒüin, T√ºlay G√ºnal, G√∂zde Cƒ±ƒüacƒ±, Ferit Aktuƒü, Rojda Demirer, Aybars Kartal √ñzson","Turkey",2016,"TV-MA","3 Seasons","International TV Shows, Romantic TV Shows, TV Dramas","July","1",2017
"s5398",,"Chloe Marsden, Aaron Marsden, Mar√≠a Esnoz","United Kingdom",2015,"TV-Y","1 Season","British TV Shows, Kids' TV","July","1",2017
"s5400",,"Romeo Tan, Sheila Sim, Yuan Shuai, Aloysius Pang","Singapore",2014,"TV-14","1 Season","International TV Shows, TV Dramas, TV Horror","July","1",2017
"s5402",,"Jeanette Aw, Patrick Lee, Huang Qi Ming, Sora Ma, Hong Huifang, Xu Bin, Chen Shucheng",,2014,"TV-14","1 Season","International TV Shows, Romantic TV Shows, TV Dramas","July","1",2017
"s5404",,"Christopher Lee, Jesseca Liu, Ann Kok, Kate Pang, Zhang Zhenhuan, Richard Low","Singapore",2011,"TV-14","1 Season","International TV Shows, Romantic TV Shows, TV Dramas","July","1",2017
"s5405",,"Chen Hanwei, Rebecca Lim, Desmond Tan, Yusuke Fukuchi","Singapore",2016,"TV-MA","1 Season","Crime TV Shows, International TV Shows, TV Dramas","July","1",2017
"s5406",,"Zoe Tay, Fann Wong, Li Nanxing, Tay Ping Hui, Elvin Ng, Felicia Chin, Jerry Yeo","Singapore",2009,"TV-14","1 Season","International TV Shows, TV Dramas","July","1",2017
"s5407",,"Rui En, Chen Liping, Tay Ping Hui, Andie Chen, Xiang Yun, Joshua Ang, Zhou Ying","Singapore",2012,"TV-14","2 Seasons","Crime TV Shows, International TV Shows, TV Dramas","July","1",2017
"s5408",,"Ha Yu, Tay Ping Hui, Jeanette Aw, Elvin Ng, Yvonne Lim, Zhang Zhenhuan, Vivian Lai, Ian Fang, Xu Bin","Singapore",2014,"TV-14","1 Season","International TV Shows, TV Dramas","July","1",2017
"s5410",,"Romeo Tan, Rebecca Lim, Sora Ma, Xu Bin, Chen Liping, Chen Hanwei, Yao Wenlong, Eelyn Kok, Dennis Chew","Singapore",2014,"TV-14","1 Season","International TV Shows, TV Dramas","July","1",2017
"s5411",,"Kingone Wang, Jesseca Liu, Xiang Yun, Chen Shucheng, Eelyn Kok, Cavin Soh, Sora Ma","Singapore",2012,"TV-14","1 Season","International TV Shows, Romantic TV Shows, TV Comedies","July","1",2017
"s5413",,"Mandy Patinkin, Joe Mantegna, Thomas Gibson, Shemar Moore, Matthew Gray Gubler, Kirsten Vangsness, A.J. Cook, Paget Brewster, Lola Glaudini, Jennifer Love Hewitt, Jeanne Tripplehorn","United States, Canada",2017,"TV-14","12 Seasons","Crime TV Shows, TV Dramas, TV Mysteries","June","30",2017
"s5414",,"Naomi Watts, Billy Crudup, Sophie Cookson, Karl Glusman, Poorna Jagannathan, Brooke Bloom, Lucy Boynton, Melanie Liburd, Brenda Vaccaro, Maren Heary, Blythe Danner","United States, United Kingdom",2017,"TV-MA","1 Season","TV Dramas","June","30",2017
"s5415",,"Megumi Han, Fumiko Orikasa, Michiyo Murase, Yoko Hikasa, Arisa Shida, Rie Murakawa, Reina Ueda, Ryosuke Kanemoto, Junko Takeuchi, Noriko Hidaka","Japan",2017,"TV-Y7","2 Seasons","Anime Series, International TV Shows","June","30",2017
"s5422",,"Emily Osment, Kym Whitley, Rex Lee, Jonathan Sadowski, Aimee Carrero, Jesse McCartney, Ashley Tisdale","United States",2017,"TV-14","5 Seasons","TV Comedies","June","21",2017
"s5423",,"Erin Mathews, Sam Vincent, Andrea Libman, Ashleigh Ball, Ian James Corlett, Brian Drummond, Lee Tockar, Matt Hill","United States, Japan, Canada",2014,"TV-Y7","2 Seasons","Kids' TV, TV Comedies","June","20",2017
"s5426",,"David Duchovny, Gethin Anthony, Grey Damon, Emma Dumont, Claire Holt, Michaela McManus, Br√≠an F. O'Byrne, David Meunier, Ambyr Childers, Tara Lynne Barr, Whitney Rose Pynn, Jason Ralph","United States",2016,"TV-MA","2 Seasons","Crime TV Shows, TV Dramas","June","16",2017
"s5429","IGINIO STRAFFI","Haven Paschall, Alysha Deslorieux, Jessica Paquet, Eileen Stevens, Kate Bristol, Saskia Maarleveld, Brittany Pressley, Billy Bob Thompson, Marc Thompson, Suzy Myers, Jason Griffith, Samara Naeymi, Wayne Grayson, Alyson Leigh Rosenfeld, Abe Goldfarb, Lisa Flanagan","Italy, United States",2017,"TV-Y7","2 Seasons","Kids' TV","June","16",2017
"s5434",,"Jin-sung Yang, Kyu-jong Kim, Tae-hwan Kang, Geummi","South Korea",2016,"TV-PG","1 Season","International TV Shows, Korean TV Shows, Romantic TV Shows","June","10",2017
"s5435",,"Jin-woo Kim, Min-ji Park, In-jun Gwak, Gi-du Kim","South Korea",2016,"TV-PG","1 Season","International TV Shows, Korean TV Shows, Romantic TV Shows","June","10",2017
"s5436","CHANG-MIN LEE","Hae-Jin Park, Sung-woong Park, Min-jung Kim, Jung-an Chae, Jung-hoon Yeon, Hyun-sung Jang, Man-sik Jung, Shin-il Kang, Ho-jin Chun, In-ho Tae","South Korea",2017,"TV-14","1 Season","Crime TV Shows, International TV Shows, Korean TV Shows","June","10",2017
"s5437",,"Ji-ho Oh, Soo-kyung Lee, Min-jae Kim, Ji-hyun Nam","South Korea",2016,"TV-PG","1 Season","Crime TV Shows, International TV Shows, Korean TV Shows","June","10",2017
"s5438",,"Joe Cheng, Lulu Xu, Jiro Wang, Viann Zhang, Han Chengyu","China",2015,"TV-14","1 Season","International TV Shows, Romantic TV Shows, TV Dramas","June","10",2017
"s5439",,"Tae-hyun Nam, Soo-yeon Kim, Seo-ra Kim, Tae-hwan Kang, Young-jo Yang","South Korea",2016,"TV-14","1 Season","International TV Shows, Korean TV Shows, TV Dramas","June","10",2017
"s5440",,"Seung-yeon Gong, Jong-hyun Lee, Yeon-seo Kim, Bo-hyun Ahn, Jai-jin Lee, Joo-hyung Park","South Korea",2017,"TV-MA","1 Season","International TV Shows, Korean TV Shows, Romantic TV Shows","June","9",2017
"s5445",,"Phoebe Waller-Bridge, Jonathan Bailey, Adrian Scarborough, Damien Molony, Louise Ford, Julie Dray, Amit Shah","United Kingdom",2016,"TV-MA","1 Season","British TV Shows, International TV Shows, Romantic TV Shows","June","2",2017
"s5446",,"Will Arnett, David Sullivan, Ruth Kearney, George Basil, Lina Esco, Travis Mills, Robert Wisdom, Mark Boone Junior, Matthew Willig, Heather Graham, Kirstie Alley, Sab Shimono, Christopher Mintz-Plasse, Minerva Garcia, Jeff Daniel Phillips","United States",2017,"TV-MA","2 Seasons","TV Comedies, TV Dramas","June","2",2017
"s5458",,"Tay Ping Hui, Joanne Peh, Zhang Yaodong, Paige Chua, Akit Tay","Singapore",2015,"TV-14","1 Season","Crime TV Shows, International TV Shows, TV Dramas","June","1",2017
"s5459",,"Sang-hyun Um, Jeong-hwa Yang, Tae-yeol Jeon, Yong-woo Shin, So-yeong Lee, Wan-kyung Sung, Soyeon, Jin-wook Hong, Yeong-wung Jeong",,2016,"TV-Y7","1 Season","Kids' TV, Korean TV Shows","June","1",2017
"s5460",,"Sam Jones","United States",2015,"TV-MA","3 Seasons","Stand-Up Comedy & Talk Shows","June","1",2017
"s5465",,"Sofie Gr√•b√∏l, Lars Mikkelsen, Harald Kaiser Hermann, Albert Rudbeck Lindhardt, Laurids Skovgaard Andersen, S√∏ren S√¶tter Lassen, Sonja Richter, David Dencik, Solbj√∏rg H√∏jfeldt, Lars Ranthe","Denmark",2016,"TV-14","1 Season","International TV Shows, TV Dramas","June","1",2017
"s5466",,"Hugo Ng, Shaun Chen, Jeanette Aw, Rebecca Lim, Zhang Zhenhuan, Ian Fang","Singapore",2016,"TV-14","1 Season","International TV Shows, TV Dramas","June","1",2017
"s5471",,"Kyle Chandler, Ben Mendelsohn, Sissy Spacek, Linda Cardellini, Norbert Leo Butz, Jacinda Barrett, Jamie McShane, John Leguizamo, Enrique Murciano, Sam Shepard, Chlo√´ Sevigny, Andrea Riseborough, Beau Bridges, Taylor Rouviere, Owen Teague, Brandon Larracuente","United States",2017,"TV-MA","3 Seasons","TV Dramas, TV Mysteries, TV Thrillers","May","26",2017
"s5478",,"Sebastian Perry","Thailand",2017,"TV-MA","1 Season","Docuseries, International TV Shows","May","19",2017
"s5480",,,"United States",2017,"TV-MA","1 Season","Crime TV Shows, Docuseries, TV Mysteries","May","19",2017
"s5489",,"Danny Jacobs, Andy Richter, Kevin Michael Richardson, India de Beaufort, Jeff Bennett, Maurice LaMarche",,2017,"TV-Y7","1 Season","Kids' TV, TV Action & Adventure, TV Comedies","May","12",2017
"s5495",,"Reece Pockney, Scott Langley, Alex Babic, Gemma Harvey, Jessica Hann, Emma Tate","Australia",2017,"TV-Y","3 Seasons","Kids' TV","May","5",2017
"s5510",,"Luna, U-kwon, Ha-na Jung, B-Bomb, Ha-seong Park","South Korea",2015,"TV-14","1 Season","International TV Shows, Korean TV Shows, Romantic TV Shows","April","28",2017
"s5511",,"Su-jong Choi, Hee-Ra Ha, Jay Kim, Ji-hye Wang, Shin-il Kang","South Korea",2010,"TV-14","1 Season","International TV Shows, Korean TV Shows, TV Dramas","April","28",2017
"s5514",,"Eun-mi Go, Jaehyo, Eun-Hyung Jo, Ha-yeon Kim, Shin Yi, Kwang-sun Park","South Korea",2015,"TV-14","1 Season","International TV Shows, Korean TV Shows, Romantic TV Shows","April","28",2017
"s5515",,"Rodolfo Sancho, Bel√©n L√≥pez, Pedro Casablanc, Luis Fern√°ndez, Patrick Criado, Nya de la Rubia, Jes√∫s Castro, Fernando Cayo","Spain",2017,"TV-MA","2 Seasons","Crime TV Shows, International TV Shows, Spanish-Language TV Shows","April","27",2017
"s5520",,"Taylor Abrahamse, Colin Doyle, Juan Chioran, Kathleen Laskey, Stacey DePass, Mike Kiss","Canada",2016,"TV-Y7","1 Season","Kids' TV, TV Comedies","April","22",2017
"s5521",,"Britt Robertson, Ellie Reed, Johnny Simmons, Alphonso Mcauley","United States",2017,"TV-MA","1 Season","TV Comedies","April","21",2017
"s5522","JILL BAUER, RONNA GRADUS, RASHIDA JONES",,"United States",2017,"TV-MA","1 Season","Docuseries","April","21",2017
"s5524",,"Chris Parnell, Max Charles, Dieter Jansen, Da'Vine Joy Randolph","United States",2017,"TV-Y7","4 Seasons","Kids' TV, TV Comedies","April","21",2017
"s5538",,"Donghyun Kim, Nahyun, Yang Hak Jin, Yoon Hwa Hong","South Korea",2016,"TV-14","1 Season","International TV Shows, Korean TV Shows, TV Dramas","April","10",2017
"s5539",,"Justice Smith, Shameik Moore, Herizen Guardiola, Skylan Brooks, Tremaine Brown,  Jr., Yahya Abdul-Mateen II, Jimmy Smits, Giancarlo Esposito, Kevin Corrigan, Stefanee Martin, Shyrley Rodriguez, Eric Bogosian, Michel Gill, Mamoudou Athie","United States",2017,"TV-MA","2 Seasons","TV Dramas","April","7",2017
"s5543",,"Yavuz Bing√∂l, Basak K√∂kl√ºkaya, √áolpan Ilhan, Mustafa Alabora, Sedef Avcƒ±, Ay√ßa ƒ∞nci, Tuncer Necmioƒülu, Serdar √ñzer","Turkey",2005,"TV-MA","1 Season","International TV Shows, TV Dramas","April","1",2017
"s5555","LAURENT BOUZEREAU","Steven Spielberg, Guillermo del Toro, Lawrence Kasdan, Francis Ford Coppola, Paul Greengrass, Meryl Streep",,2017,"TV-MA","1 Season","Docuseries","March","31",2017
"s5556","GORDON ANDERSON","David Hasselhoff, Asim Chaudhry, Fergus Craig, Mark Quartley, Ella Smith, Brett Goldstein","United Kingdom",2016,"TV-MA","2 Seasons","British TV Shows, TV Comedies","March","31",2017
"s5559",,"Jason Callender, Kathryn Drysdale, Akiya Henry, Jeff Rawle, Richard Grieve, Simone Craddock, Alex Babic, Miriam Margolyes","United States, United Kingdom, Australia",2017,"TV-Y7","2 Seasons","British TV Shows, Kids' TV","March","24",2017
"s5563","STAN LATHAN","Dave Chappelle","United States",2017,"TV-MA","1 Season","Stand-Up Comedy & Talk Shows, TV Comedies","March","21",2017
"s5564",,"Makoto Furukawa, Kaito Ishikawa, Yuki Kaji, Aoi Yuki, Kazuhiro Yamaji, Kenjiro Tsuda, Minami Takayama, Tessho Genda","Japan",2015,"TV-14","1 Season","Anime Series, Crime TV Shows, International TV Shows","March","20",2017
"s5567",,"Julie Andrews, Giullian Yao Gioiello, Jennifer Barnhart, Tyler Bunch, Frankie Cordero, Stephanie D'Abruzzo, Dorien Davies, John Kennedy, John Tartaglia","United States",2017,"TV-Y","1 Season","Kids' TV","March","17",2017
"s5568",,,"Australia",2015,"TV-MA","3 Seasons","Reality TV","March","17",2017
"s5570",,"Naoto Takenaka, Tetsuji Tamayama, Honami Suzuki","Japan",2017,"TV-PG","1 Season","International TV Shows, TV Dramas","March","17",2017
"s5576",,,"United States",2016,"TV-PG","1 Season","Reality TV, Teen TV Shows","March","14",2017
"s5579",,"Brian Atkinson, Ted Raimi, Harry Chaskin, Justin Michael, Debi Derryberry, Philip Maurice Hayes, Leigh Kelly, J.D. Ryznar, Nick Shakoour, Ryan Wiesbrock, Clark Wiesbrock","United States",2017,"TV-Y7","1 Season","Kids' TV, TV Comedies","March","10",2017
"s5581",,"L, So-hui Yoon, Gi-du Kim, Chang-hwan Kim, Ji Su, Tae-im Lee, Nam-gil Kang","South Korea",2016,"TV-14","1 Season","International TV Shows, Korean TV Shows, Romantic TV Shows","March","10",2017
"s5584",,"Murat √únalmƒ±≈ü, Birce Akalay, Selen Soyder, Erman Okay, Kanbolat Gorkem Arslan, Levent Yilmaz, Ayseg√ºl G√ºnay, Selma Kutluƒü, Ulvi Alacakaptan, ƒ∞pek Erdem, Yilmaz Calayir, Isil Y√ºcesoy","United Kingdom",2010,"TV-14","1 Season","International TV Shows, TV Dramas","March","1",2017
"s5586",,"Lee Hak Joo, Ji-an Kim, Jae-yoon Lee, Heo Ji Won, Yang Hak Jin, Choi Yeong Min","South Korea",2016,"TV-MA","1 Season","International TV Shows, Korean TV Shows, TV Action & Adventure","March","1",2017
"s5592",,"Benny Emmanuel, Mayt√© Cordeiro, Andr√©s Couturier, Ricardo O'Farrill, Alondra Hidalgo, Alejandro Villeli, Sof√≠a Ni√±o de Rivera, Johnny Rose, Annemarie Blanco, Oscar Cheda, Paul Tei, Cydney J. Fam, Lisa Grossman","Mexico",2017,"TV-Y7","1 Season","Kids' TV","February","24",2017
"s5593",,"Kwang-soo Lee, Dae-Myung Kim, So-min Jung, Byeong-ok Kim, Mi-kyung Kim","South Korea",2016,"TV-14","1 Season","International TV Shows, Korean TV Shows, TV Comedies","February","24",2017
"s5594",,"Alper Saldƒ±ran, Zeynep √áamcƒ±, Burcu Altƒ±n, Umut Kurt, Eda Ece, Ozan Osmanpa≈üaoƒülu, Mert Turak, Burcu Biricik, Yusuf Akg√ºn, Selen U√ßer","Turkey",2015,"TV-PG","3 Seasons","International TV Shows, Romantic TV Shows, TV Comedies","February","22",2017
"s5599",,"Sung-yeol Lee, Ji-hyun Nam, Clara Lee, Jin Won","South Korea",2013,"TV-14","1 Season","International TV Shows, Korean TV Shows, Romantic TV Shows","February","17",2017
"s5602",,"So-hyun Kim, Min-hyuk Lee, Ki-joon Uhm, Da-Ye Kim, Seung-do Baek, Shin-ae Seo","South Korea",2016,"TV-14","1 Season","International TV Shows, Korean TV Shows, TV Dramas","February","15",2017
"s5604",,"Jong-chan Na, Bo-ra Nam, Da-young Joo, Yeo One, Ki-sung Bae, Jin-joo Park, Eun-soo Kwon","South Korea",2016,"TV-PG","1 Season","International TV Shows, Korean TV Shows, Romantic TV Shows","February","15",2017
"s5609",,"Yo-Won Lee, Goo Jin, U-ie, Hae-in Jung, Gook-hwan Jeon, Han-yong Jeong","South Korea",2016,"TV-14","1 Season","International TV Shows, Korean TV Shows, TV Dramas","February","14",2017
"s5610",,"Keisuke Koumoto, Risa Taneda, Misato Fukuen, Takuya Sato, Satoshi Hino, Kenji Nomura, Mitsuaki Madono, Setsuji Sato, Haruki Ishiya, Ryo Sugisaki, Yui Makino, Kazuhiko Inoue, Yuko Kaida","Japan",2017,"TV-14","1 Season","Anime Series, International TV Shows","February","10",2017
"s5641",,"Mariee Devereux, Kazumi Evans, Maryke Hendrikse, Matt Hill, Diana Kaarina, Jocelyne Loewen, Sabrina Pitre","United States",2017,"TV-Y","1 Season","Kids' TV, TV Comedies","January","10",2017
"s5651",,"Avery Brooks, Nana Visitor, Rene Auberjonois, Cirroc Lofton, Alexander Siddig, Colm Meaney, Armin Shimerman, Terry Farrell, Michael Dorn","United States",1999,"TV-14","7 Seasons","TV Action & Adventure, TV Sci-Fi & Fantasy","January","1",2017
"s5654",,"Ji-yeon Park, Dong-ho Kang, Chul-woong Kang, Bo-hyun Ahn, Hak Jin, Se-jin Park, Kisum","South Korea",2016,"TV-14","1 Season","International TV Shows, Korean TV Shows, Romantic TV Shows","December","30",2016
"s5655",,"Mamoru Miyano, Yoshimasa Hosoya, Jun Fukuyama, Hochu Otsuka, Daisuke Hirakawa, Takahiro Sakurai, Mikako Komatsu, Hiroyuki Kinoshita, Aya Suzaki","Japan",2016,"TV-MA","2 Seasons","Anime Series, International TV Shows","December","27",2016
"s5656",,"Cameron Dallas, Aaron Carpenter, Taylor Caniff, Willie Jones, Trey Schafer, Bart Bordelon, Blake Gray","United States",2016,"TV-14","1 Season","Reality TV, Teen TV Shows","December","27",2016
"s5659",,"Tuppence Middleton, Brian J. Smith, Doona Bae, Max Riemelt, Naveen Andrews, Daryl Hannah, Freema Agyeman, Terrence Mann, Adam Shapiro, Max Mauff, Alfonso Herrera, Er√©ndira Ibarra, Aml Ameen, Jamie Clayton, Tina Desae, Miguel √?ngel Silvestre, Toby Onwumere, Joe Pantoliano","United States",2018,"TV-MA","2 Seasons","Crime TV Shows, TV Dramas, TV Mysteries","December","23",2016
"s5663",,"Cara Theobold, Susan Wokoma, Riann Steele, Arinz√© Kene, Lewis Reeves, Tony Curran","United Kingdom",2016,"TV-MA","1 Season","British TV Shows, International TV Shows, TV Comedies","December","16",2016
"s5666",,"Jae Hee, Soo-kyung Lee, So-yi Yoon, Ji-ho Shim, Sang-Myeon Park, Joo-young Kim","South Korea",2012,"TV-PG","1 Season","International TV Shows, Korean TV Shows, Romantic TV Shows","December","15",2016
"s5668",,"Soo-hyun Hong, Si Won Ryu, Ji-yoon Park, Min-soo Kim, Julien Kang, Joo-eun Oh, Seong-mo Jeong","South Korea",2012,"TV-14","1 Season","International TV Shows, Korean TV Shows, Romantic TV Shows","December","15",2016
"s5669",,"Hee-Jin Lee, Hae-seong Kwon, Paul Stafford, Mi-ji Lee, Ik-tae Kim, Ki-hyeon Kim","South Korea",2012,"TV-14","1 Season","International TV Shows, Korean TV Shows, TV Dramas","December","15",2016
"s5670",,"Bul-am Choi, Ho-Jeong Yoo, Sae-ron Kim, Chan-hee Kang, Woo-Sung Hyun, An Seo Hyun, Ho-Jin Kim","South Korea",2011,"TV-MA","1 Season","International TV Shows, Korean TV Shows, TV Dramas","December","15",2016
"s5671",,"Feng Shaofeng, Victoria Song, Ma Tianyu, Zhang Meng, Hee-seon Kim, Gong Beibi, Shao Bing, Hu Bing, Wang Duo","China",2016,"TV-14","1 Season","International TV Shows, TV Action & Adventure, TV Sci-Fi & Fantasy","December","15",2016
"s5672",,"Jae-suk Han, Sun-Young Park, Du-shim Ko, Ye-jin Lim, Jong-hwan Choi, Ha-Nui Lee, Yun-Hoo Ko, Byeong-Ki Kim, Sun-kyung Kim, Yoon-Sik Baek","South Korea",2012,"TV-14","1 Season","International TV Shows, Korean TV Shows, TV Dramas","December","15",2016
"s5673",,"Kappei Yamaguchi, Satsuki Yukino, Kumiko Watanabe, Noriko Hidaka, Koji Tsujitani, Houko Kuwashima, Toshiyuki Morikawa, Richard Ian Cox, Moneca Stori, Paul Dobson, Kirby Morrow, Kelly Sheridan, Jillian Michaels","Japan",2001,"TV-14","2 Seasons","Anime Series, International TV Shows","December","15",2016
"s5674",,"Jung Eun Kim, Yu-hwan Park, Eun-ah Go, Yong Hwan Kwak, Jin Hyuk","South Korea",2012,"TV-14","1 Season","International TV Shows, Korean TV Shows, Romantic TV Shows","December","15",2016
"s5675","JAMES HAWES","Colin Morgan, Bradley James, Katie McGrath, Angel Coulby, Richard Wilson, Anthony Head, John Hurt, Nathaniel Parker","United Kingdom",2012,"TV-PG","5 Seasons","British TV Shows, International TV Shows, TV Action & Adventure","December","15",2016
"s5676",,"Dong-hae Lee, Seung-ah Yoon, Jin-hyuk Choi, So-young Yoo, Yeo-jin Hong, Min-jin Jung","South Korea",2012,"TV-PG","1 Season","International TV Shows, Korean TV Shows, Romantic TV Shows","December","15",2016
"s5678",,"Marcel Hensema, Paul Freeman, Irrfan Khan, Stacy Keach, Michael Ironside, Stephen McHattie, Shinya Tsukamoto","Canada, Japan, Netherlands",2017,"TV-MA","1 Season","International TV Shows, TV Dramas","December","13",2016
"s5681",,,"United Kingdom",2016,"TV-MA","1 Season","Crime TV Shows, Docuseries","December","9",2016
"s5684",,"Tory Belleci, Kari Byron, Grant Imahara","United States",2016,"TV-14","1 Season","Docuseries, International TV Shows, Reality TV","December","9",2016
"s5685",,"Esther Wu, Dino Lee, Gong Yi Teng, Xi Wei Lun, Honduras, Vega Tsai, Shen Chang Hung","Taiwan",2016,"TV-14","1 Season","International TV Shows, Romantic TV Shows, TV Comedies","December","8",2016
"s5687",,,"France, Germany",2015,"TV-14","1 Season","Docuseries, International TV Shows","December","8",2016
"s5691",,"D.J. Cotrona, Zane Holtz, Eiza Gonzalez, Jesse Garcia, Madison Davenport, Brandon Soo Hoo, Wilmer Valderrama, Robert Patrick, Jake Busey, Samantha Esteban, Don Johnson","United States",2016,"TV-MA","3 Seasons","Classic & Cult TV, TV Action & Adventure, TV Horror","December","5",2016
"s5693",,"Victoria Baldesarra, Sarah Carmosino, Jordan Clark, DeShaun Clarke, Keara Graves, Katrina Hachey, Shane Harte, Ali Milner, Levi Randall, Brittany Raymond, Trevor Tordjman, Michael Torontow, Alex Zaichkowski, Matthew Bacik, Alyssa Baker, Ella Jonas Farlinger, Ian Matthews, Rakim Kelly, Bailey Pelkman, Olivia Solo","Canada",2016,"TV-G","2 Seasons","Kids' TV, TV Comedies, TV Dramas","December","3",2016
"s5700",,"Marcus Chang, Ivy Shao, Mini Tsai, Yorke Sun, Ray Yang, Chang Chieh","Taiwan",2016,"TV-PG","1 Season","International TV Shows, Romantic TV Shows, TV Comedies","December","1",2016
"s5701",,"Baron Chen, Megan Lai, Bii, Katie Chen, Sean Lee","Taiwan",2015,"TV-PG","1 Season","International TV Shows, Romantic TV Shows, TV Comedies","December","1",2016
"s5704",,"Aaron Yan, Joanne Tseng, Lene Lai, Jack Lee, JR","Taiwan",2016,"TV-14","1 Season","International TV Shows, Romantic TV Shows, TV Comedies","December","1",2016
"s5708",,"Lauren Graham, Alexis Bledel, Kelly Bishop, Scott Patterson, Yanic Truesdale, Matt Czuchry, Liza Weil, Milo Ventimiglia, Sean Gunn, Keiko Agena, Rose Abdoo, Melissa McCarthy","United States",2016,"TV-14","1 Season","TV Comedies, TV Dramas, Teen TV Shows","November","25",2016
"s5716",,"Ana Mar√≠a Estupi√±√°n, Sebastian Eslava, Juan Sebasti√°n Arag√≥n, Diego V√°squez, Carlos Velazquez, Marcela Benjumea, Melisa Caceres, Michelle Orozco, Alberto Carde√±o, Constanza Camelo, Fernando Ar√©valo","Colombia",2016,"TV-MA","1 Season","Crime TV Shows, International TV Shows, Spanish-Language TV Shows","November","18",2016
"s5717",,"Indira Varma, Robert Glenister, Dino Fetscher, Neil Stuke, Christiane Paul, Lesley Sharp, Kevin Doyle","United Kingdom",2016,"TV-MA","1 Season","British TV Shows, Crime TV Shows, International TV Shows","November","17",2016
